video_name,caption,emotion
2751812.mp4,There's something strange about myself.,Neutral
98592049.mp4,I never lived in a house...,Neutral
98857459.mp4,I was born in Florida.,Neutral
98881709.mp4,I lived there in a house with my parents and two brothers...,Neutral
98895873.mp4,... while I was growing up until I was six  and a half years old.,Neutral
99038142.mp4,My family decided to move to Vermont because my father got a job transfer with IBM.,Neutral
99065608.mp4,"We were okay with it, so that`s when my family moved there.",Neutral
99084529.mp4,I grew up there between the age of six and a half and thirteen.,Neutral
99164108.mp4,"Still when I was twelve and a half years old, after six and a half years in all, my father found out that he would have to move away again",Neutral
99210571.mp4,"Because his job involved a big project located south, in New York.",Neutral
76719526.mp4,"So, it wasn't worth it for him to commute frequently for a long distance, it was better for the family to move away.",Neutral
99305816.mp4,"So, we agreed with the decision and went ahead and moved south to New York; it was around an hour north of NYC.",Neutral
99370717.mp4,"But, you might wonder how I managed, with moving frequently, well I was home schooled.",Neutral
99395897.mp4,so I didn`t need to worry about attending a hearing school or a Deaf school.,Neutral
99454786.mp4,"My mother taught my two brothers and me, so it was easier for us to move around.",Neutral
99499600.mp4,So we moved south to New York,Neutral
99523150.mp4,That went on for around six years.,Neutral
99571136.mp4,"I guess I should`ve been moving away again, but my parents were okay with the same job.",Neutral
99639413.mp4,"So, may seem like I stayed there longer than seven years.    But then it hit me...",Neutral
83323313.mp4,I decided I wanted to transfer  to the Rochester Institute.,Neutral
83360967.mp4,"I wanted to be involved in sports and after-school activities, plus many other things. I wanted to be more socialized. So,",Neutral
83444920.mp4,"My parents were alright with it. I transferred to RSD, I stayed in the dorm.",Neutral
83470674.mp4,"So basically, I almost never went home to except for vacations or long weekends, that`s when I would commute. But, most of the time I stayed in Rochester...",Neutral
83507101.mp4,"... for two years, when I was a junior and then a senior in high school. After I graduated from high school, I went to R.I.T., Rochester Institute of Technology.",Neutral
83537939.mp4,"I moved into the dorm again. During that time, my parents had been living where they were for more than seven years, but I had already left home before that.",Neutral
83594638.mp4,When I was nearly all done with RIT. after about my third year. my father sensed that he had pretty much had it with IBM; he wanted to retire and change his career.,Neutral
83719008.mp4,"So, the family in fact move here, and I took the opportunity to move in and live with my family at the new house in Rochester.",Neutral
83757971.mp4,"Since then, I have lived there for around almost three years.",Neutral
83875522.mp4,"I graduated recently, so that`s means I`ll be looking for a job, probably I`ll move away, so I won't have lived there for seven years.   Now, I`m wondering from now on with the new job does that mean I might be moving around again for the next seven years or less?   So I`m wondering, let`s see, oh well.",Neutral
25317.mp4,I will talk about the early invention field and how hospitals deal with informing the parents when the child is Deaf.,Neutral
25339.mp4,"I will list some. For example, the power of language in hospitals.",Neutral
253410.mp4,"Not just in the hospitals, but in general.",Neutral
253411.mp4,There is one interesting study. What the study did they grouped people together and have them watch a video clip of car accident.,Neutral
253512.mp4,Then they regathered the groups a week later and asked them some questions.,Neutral
253613.mp4,"For example, they used different words for each group while asking them the questions.",Neutral
253714.mp4,One group would use the word HIT; other group uses SMASHED; and another group uses COLLIDED. I think there are four or five different words/groups.,Neutral
254018.mp4,"Similarly, the study asks them how fast were the cars going before they crashed into each other.",Neutral
255439.mp4,"So, for the HIT group, they asked them how fast were the cars going before they HIT?",Neutral
255540.mp4,Ask the next group how fast were the cars going before they COLLIDED.,Neutral
254019.mp4,The study notices how the HIT group thinks that the glass wasn't broken at all.,Neutral
255641.mp4,"The car was going around 20 mph when it smashed. The SMASHED group said they think the car's glass was broken and it was going around 60 mph. But, actually, the glass wasn't broken at all.",Neutral
254120.mp4,Car was going only twenty to thirty MPH. It shows how the language influences individuals' answers even though they all were watching the same video clip.,Neutral
254221.mp4,That's how powerful the language is.,Neutral
254222.mp4,"We will be talking about early intervention now. When parents gives a birth to a baby, the baby would go to a hearing screening.",Neutral
254323.mp4,The screening shows that the baby is deaf.,Neutral
254626.mp4,Then they would refer the parents to the early intervention professionals.,Neutral
254627.mp4,"The meeting will include a specialist, audiologist, doctor, nurse, counselor, and social worker. There are seven specialists for only two parents. Wow.",Positive
255742.mp4,"While for the deaf babies, they are not any of them.",Neutral
254830.mp4,Now parents often would start considering discussing with the hospital for the early intervention. But the word makes it seems like they are intervening.,Positive
255032.mp4,It seems like the hospital needed to intervene because the parents were doing lousy job with their child.,Neutral
255134.mp4,"Why don't we use ""early involvement"", which means involving the parents by sharing the resources and working together; and not intervening them.",Neutral
255235.mp4,"Thirdly, the hospital often will discuss about the communication options.",Neutral
255236.mp4,"It seems that parents must choose one between oralism, cochlear implant, sign language or cued-speech. They can't pick all of the options.",Neutral
255337.mp4,"They really can do all of the options. One family can choose to use sign language, and if another family wants to use speech, that's fine.",Neutral
255743.mp4,It's important that the child signs. Hospitals don't use 'communication opportunities' as their word choices.,Neutral
255945.mp4,"The doctors often would say ""We should discuss the grief progress. Here's the social worker and counselor, they will help you to nagivate the grief progress.""",Neutral
256047.mp4,Why don't we discuss it as the journey through experience?,Neutral
256148.mp4,It would turn into a positive thing.,Positive
256149.mp4,Often in the meeting; all people in the room are hearing except for the baby.,Neutral
256250.mp4,We should bring in the Deaf mentor to meet the parents.,Neutral
256453.mp4,"The parents will realize and embraces the situation more calmly. Without a Deaf role model, we are missing the link of connection between the parents and the Deaf person.",Neutral
256554.mp4,The researches have proven that a child with a Deaf mentor often perform better. There is a research that studies two groups from Utah and Tennessee.,Neutral
256555.mp4,The early intervention services for both groups had the same checklist.,Neutral
256656.mp4,Both locations had the same number of meetings; same occurences of home visits; same kind of school; and the same resources.,Neutral
256657.mp4,"Except for Utah group, the child had a Deaf mentor, while the group from Tennessee did not.",Neutral
256758.mp4,"The study noticed that the Deaf child from Utah resulted in better social, emotion and cognitive developments.",Neutral
256859.mp4,It makes sense because the parents will learn from the Deaf mentor after including him/her in the family. The parents will start to realize how important it is to involve in the Deaf community.,Neutral
256860.mp4,Parents cannot simply rely on a Deaf mentor. They must do more such as being involved in the Deaf community.,Neutral
256961.mp4,Be friends with their child's friend's parents. It's important to be connected and they must collaborate with others.,Positive
257062.mp4,There is another research in Australia with the similar idea.,Neutral
257063.mp4,"There are two groups with same guidelines. One group has Deaf professionals being involved, while another group did not.",Neutral
257164.mp4,The parents of the group with Deaf professionals would get through the grief progress quicker and usually be able to move on quickly.,Neutral
257266.mp4,"So, the family must have a Deaf role model supporting them.",Neutral
257367.mp4,"Therefore, overall, there's a missing link. If we change that, it will influence the deaf children to develop better.",Neutral
745937.mp4,Last week John arrived late.,Neutral
745928.mp4,I just arrived now.,Neutral
745929.mp4,I hope John arrives on time next week.,Neutral
7459110.mp4,I got a B on last week's test.,Neutral
7459011.mp4,I'm studying this week for the test.,Neutral
7458912.mp4,I hope I pass the test next week.,Neutral
7458813.mp4,I went shopping and spent two hundred dollars.,Neutral
7458714.mp4,This week I didn't save money.,Neutral
7458615.mp4,I'm going out again next week to spend all my money.,Neutral
7458616.mp4,I already went out and saw the movie.,Neutral
7458517.mp4,"Tonight, I'm going to a movie.",Neutral
7458418.mp4,I'm going to the movies again next week.,Neutral
756517.mp4,Mary had a baby girl.,Neutral
756528.mp4,Mary and John will leave tomorrow.,Neutral
756529.mp4,I told him/her tomorrow it would rain.,Neutral
7565310.mp4,"Last year, we read a lot of books.",Neutral
7565411.mp4,I've been here all day; I want to leave.,Neutral
7565512.mp4,"Wow, his/her friend is a tall man.",Positive
7565513.mp4,I know he/she reads a lot of books.,Neutral
7565614.mp4,Maybe Mary will give birth to a big baby.,Neutral
7565915.mp4,Maybe tomorrow it will stop raining.,Neutral
7566016.mp4,"If it stops raining tomorrow, I will leave.",Neutral
7566017.mp4,I know that he/she finished reading the book.,Neutral
7566118.mp4,I don't want to read; I want to leave.,Neutral
7566219.mp4,I already announced that it will rain tomorrow.,Neutral
7566320.mp4,"Wow, he/she left fast.",Positive
7566321.mp4,Mary has many different friends.,Neutral
7566422.mp4,He/She knows many different men.,Neutral
7566523.mp4,All the men left together.,Neutral
7566624.mp4,I know he/she leaves tomorrow.,Neutral
7566625.mp4,What did he/she decide?,Neutral
7566726.mp4,Maybe his/her car is here.,Neutral
7566827.mp4,He/She used to own a big boat.,Neutral
7566928.mp4,What did Mary's name used to be?,Neutral
7567029.mp4,What did the man tell him/her?,Neutral
7567030.mp4,Mary knows many different languages.,Neutral
7567131.mp4,We should leave together.,Neutral
7567232.mp4,Maybe the two of us can leave tomorrow.,Neutral
7567233.mp4,What did he/she decide to tell John?,Neutral
7567334.mp4,Mary used to live in Boston.,Neutral
7567435.mp4,Where was the man born? He was born in Chicago.,Neutral
7567436.mp4,Mary and that man leave tomorrow.,Neutral
7567537.mp4,My car is fancy and blue.,Neutral
7567638.mp4,His/Her father left.,Neutral
7567639.mp4,I already told them that I'm going out tomorrow.,Neutral
7567740.mp4,My father used to be tall but now he's short.,Neutral
7567841.mp4,My car is different now. It's small not big.,Neutral
7567842.mp4,The man decided he didn't want a big car; he prefers a small car.,Neutral
7567943.mp4,"I wasn't born here, I was born in a different country.",Neutral
7568044.mp4,The man decided to read a book tomorrow.,Neutral
7568045.mp4,Maybe John and Mary will decide to work together now.,Neutral
7568146.mp4,"Yesterday, it rained all day.",Neutral
7568247.mp4,It's raining. Would you prefer driving?,Neutral
7568248.mp4,Many children are born everyday.,Neutral
7568349.mp4,"I know, he/she already told me.",Neutral
7568450.mp4,What did John buy today? He bought a big poster.,Neutral
7568451.mp4,Did you know? the president arrived yesterday,Neutral
7568552.mp4,The president and his wife arrived together.,Neutral
7568653.mp4,"I used to see the president on TV, but in person, he looks different.",Neutral
7568754.mp4,"After the president leaves, I will talk with the reporters.",Neutral
7568755.mp4,"When the president leaves, I will talk with the reporter.",Neutral
7568856.mp4,"Wow, someone told me that the president might get fired.",Neutral
7568957.mp4,I want to go out now.,Neutral
7568958.mp4,I used to lie but now I tell the truth.,Neutral
7569059.mp4,"Wow, it's raining now, whatever, I'm going out still.",Positive
7569160.mp4,Wow. There are so many big cakes of different kinds; do I have to pick one?,Positive
7569161.mp4,"I know I'm late, but I will be finished soon.",Neutral
7569262.mp4,Everyone knows that John left to drive to Maine.,Neutral
7569363.mp4,"Wow, that man knows George Clooney.",Positive
7569364.mp4,Now there is a big expensive house. It's really beautiful.,Positive
7569465.mp4,"Wow, that man recently bought something big, but I can't tell you what it is.",Neutral
7569466.mp4,Pete loves driving; he has many different cars.,Positive
7569567.mp4,"I used to read the New York Times, but now I read the Boston Globe and wow it's different.",Positive
7569668.mp4,"I was born and raised in Boston. Now, I have lived here for many years.",Neutral
7569669.mp4,My friend told me she/he was born in Chicago.,Neutral
7569770.mp4,Sue and Ben decided to move here to Boston. They arrived last year.,Neutral
7569871.mp4,I don't want to go out; it's raining now.,Neutral
7569872.mp4,Who was born in September? My brother and my father.,Neutral
5080307.mp4,John arrived yesterday.,Neutral
5080298.mp4,Mary owns many different cars.,Neutral
5080289.mp4,Mary knows it rained here yesterday.,Neutral
50802710.mp4,Mary bought a car yesterday.,Neutral
50802711.mp4,"Wow, Mary gave birth to a big baby.",Positive
50802612.mp4,Her car is here.,Neutral
50802513.mp4,My car is here.,Neutral
50802414.mp4,The man and the woman arrived here together.,Neutral
50802415.mp4,John tells Mary many lies.,Neutral
50802316.mp4,What does Mary own a lot of?,Neutral
50802217.mp4,John reads many books.,Neutral
50802118.mp4,John has a different car.,Neutral
50802119.mp4,Mary has a different bike.,Neutral
50802020.mp4,John decided he would buy the car.,Neutral
50801921.mp4,Now Mary knows John.,Neutral
50801922.mp4,Maybe Mary will buy a car.,Neutral
50801823.mp4,What did John decide yesterday?,Neutral
50801724.mp4,What did John decide yesterday?,Neutral
50801625.mp4,"Yesterday, it rained four times.",Neutral
50801526.mp4,Mary decided to buy a new car.,Neutral
50801527.mp4,Now the two of us know who arrived yesterday.,Neutral
50801428.mp4,John came yesterday and left.,Neutral
50801329.mp4,Mary decided to tell John.,Neutral
50801330.mp4,Maybe John will move here.,Neutral
50801231.mp4,Maybe John will live here.,Neutral
50801132.mp4,"Mary's not here, she just left.",Neutral
50801133.mp4,Mary loves many men.,Positive
50801034.mp4,What did Mary find yesterday? She found a mouse.,Neutral
50800935.mp4,Mary has a good car now.,Neutral
50800936.mp4,Mary used to teach but now she works online.,Neutral
50800837.mp4,"Mary enjoys acting, not reading.",Positive
50800738.mp4,Mary arrived late.,Neutral
50800639.mp4,John and Mary arrived together.,Neutral
50800640.mp4,Mary arrived in Chicago last week.,Neutral
3373547.mp4,"You are wrong. No, I prefer lox, I don`t like pineapple cream cheese.",Neutral
33733337.mp4,"You're wrong, that is not pineapple cream cheese. I prefer lox.",Neutral
33733238.mp4,"No, I don't like pineapple cream cheese. I prefer lox.",Neutral
3373548.mp4,"No, I would not stop vomitting if I ate pineapple cream cheese. I prefer lox.",Neutral
3373539.mp4,"No, I wouldn't stop vomiting if I had pineapple cream cheese. Lox only is fine with me.",Neutral
33735210.mp4,"No, not pineapple cream cheese. Lox is better for me, that's it.",Neutral
33732942.mp4,I already know that there's pineapple cream cheese.,Neutral
33733139.mp4,I hope there's pineapple cream cheese.,Neutral
33735111.mp4,I wish there was pineapple cream cheese.,Neutral
33735112.mp4,I really do have pineapple cream cheese.,Neutral
33735013.mp4,I won't be thrilled if there's pineapple cream cheese.,Neutral
33734914.mp4,"If all the students arrive on time, there won't be a test.",Neutral
33734815.mp4,"If you're arriving late, it's fine. I just have to call the restauarnt and postpone the reservation.",Neutral
33734816.mp4,"If all the students pass the test, then there will be no school tomorrow.",Neutral
33734717.mp4,"If my mom says I can go to the concert, I'll be thrilled.",Neutral
33734618.mp4,I'm excited for when my friend and I go to the concert.,Positive
33734519.mp4,I will be thrilled if I see my friend tomorrow.,Positive
33734520.mp4,"I'm letting you know that the car is broken down, I used the the right key.",Neutral
33734421.mp4,"No, I did use the right key. The car is broken.",Neutral
33733140.mp4,"I'm serious, the car is broken. I tried the key but it isn't working.",Neutral
33734322.mp4,"No, I don't have a car.",Neutral
33734323.mp4,I don't have a car at all.,Neutral
33734224.mp4,"No, I don't have a car.",Neutral
33734125.mp4,"Nope, I don't have a car.",Neutral
33734026.mp4,"If it's snowing out, then school is cancelled.",Neutral
33733927.mp4,"If it's snowing outside a lot, will school be cancelled?",Neutral
33733928.mp4,When it snows out a lot school closes right?,Neutral
33733829.mp4,"If there's no snow outside, normally school will be open.",Neutral
33733730.mp4,If there's no snow outside then normally school isn't cancelled.,Neutral
33733731.mp4,If it stops snowing outside then school will reopen tomorrow.,Neutral
33733632.mp4,"If it snows tomorrow, then it's a guarantee that school will be closed.",Neutral
33733533.mp4,Who went out when it was raining?,Neutral
33733534.mp4,The teacher made the reading required for John so he had to read the book.,Neutral
33733435.mp4,The teacher didn't make the reading required. It's uncertain whether or not John will read the book now.,Neutral
33733336.mp4,The teacher didn't make the reading required so John didn't read.,Neutral
33733041.mp4,"If the teacher requires John to do it,  John will read the book.",Neutral
2388447.mp4,John broke the window?,Neutral
2388438.mp4,"Did John break the window?  no, he broke the door.",Neutral
2388429.mp4,"John didn't break the window, he cracked it.",Neutral
23884210.mp4,John didn't break the window Sally did.,Neutral
23884111.mp4,"No, Mary didn't stop rowing.",Neutral
23884012.mp4,"No, Mary didn't quit rowing.",Neutral
23883913.mp4,Mary never started rowing.,Neutral
23880659.mp4,France's king is bald.,Neutral
23883914.mp4,"France`s king is bald. No, that's not true.",Neutral
23883815.mp4,France has a king now?,Neutral
23883716.mp4,Is France's current king bald? No...,Neutral
23880660.mp4,"Is the king of France bald? No, France doesn't have a king now.",Neutral
23880561.mp4,Now France's king is bald.,Neutral
23883617.mp4,"Yes, he/she talks a lot.",Neutral
23883618.mp4,Obama is from Philadelphia.,Neutral
23883519.mp4,"Obama isn't from Philadelphia, he's from Chicago.",Neutral
23883420.mp4,"No, he's not from Philadelphia.",Neutral
23883421.mp4,Bob doesn't know president Silber because he isn't the president anymore.,Neutral
23883322.mp4,You're going to the mall today? Can I join? My car has a flat.,Neutral
23883223.mp4,"Does your car have a flat? No, it doesn't.",Neutral
23883124.mp4,"No, it didn't rain.",Neutral
23883025.mp4,"No, he/she did not come home.",Neutral
23882926.mp4,"In the event of no snow, my trip has to be cancelled.",Neutral
23882927.mp4,"When there is no snow, my (starts signing ""trip"") ski trip will be cancelled.",Neutral
23882828.mp4,"When there's no snow, my ski trip is cancelled.",Neutral
23882729.mp4,"If there is no snow, my trip is cancelled.",Neutral
23882730.mp4,If there is no snow I will cancel my ski trip.,Neutral
23882631.mp4,"When it snows, school is cancelled.",Neutral
23882532.mp4,"When it snows, school is cancelled.",Neutral
23882533.mp4,"In event of snow, school is cancelled.",Neutral
23882434.mp4,"If it snows, school is cancelled.",Neutral
23882335.mp4,"If it snows, school is cancelled.",Neutral
23882236.mp4,"If it snows, school is cancelled.",Neutral
23882237.mp4,"When it snows, school isn't cancelled.",Neutral
23882138.mp4,"When it snows, school is not cancelled.",Neutral
23882039.mp4,"If it snows, school won't be cancelled.",Neutral
23882040.mp4,"In the event of snow, school is not cancelled.",Neutral
23881941.mp4,"If it snows, school still won't be cancelled.",Neutral
23881842.mp4,"If it snows, school is not cancelled.",Neutral
23881843.mp4,School will continue if it snows. It won't be cancelled.,Neutral
23881744.mp4,"No, when it does not snow, school will still be in session.",Neutral
23881645.mp4,"In the event of no snow, there is still school.",Neutral
23881646.mp4,"If there is no snow, school will continue.",Neutral
23881547.mp4,"If there is no snow, then school will continue.",Neutral
23881448.mp4,I stay home when it rains.,Neutral
23881349.mp4,I stay home when it rains.,Neutral
23881350.mp4,"When it happens to rain, I stay home.",Neutral
23881251.mp4,"If it's raining, I""m staying home.",Neutral
23881152.mp4,"If it's raining, I stay home.",Neutral
23881053.mp4,"If it's raining, I stay home.",Neutral
23881054.mp4,"When it's raining, I go out, I don't stay home.",Neutral
23880955.mp4,"When it rains, I'm not staying home, I'm going out.",Neutral
23880857.mp4,"When it rains, I still go out.",Neutral
23880758.mp4,If it's raining I'm still going outside.,Neutral
23880856.mp4,"If it's raining, I'm not going out.",Neutral
7028847.mp4,"Two plus one equals six. No, two plus one equals three.",Neutral
7028838.mp4,"Your family, specifically your parents, are important.",Neutral
7028829.mp4,"Just so you know, your fingerspelling is lousy.",Negative
70288210.mp4,What's the name of the city where BU is? Oh it's Boston?,Neutral
70288111.mp4,"What's the name of the city where BU is? Bustun? No, it's Boston.",Neutral
70288012.mp4,"No, I told her that it was fine.",Neutral
70287913.mp4,You said you wanted to punish him/her so go ahead don't dismiss it.,Negative
70287814.mp4,It's illegal to not have a tax.,Negative
70287815.mp4,You are breaking the rules if there is no tax.,Neutral
70287716.mp4,I am warm too.,Neutral
70287617.mp4,I'm tired.,Neutral
70287518.mp4,I'm happy.,Positive
70287419.mp4,You don't want anything?,Neutral
70287420.mp4,You don't want anything?,Neutral
70287321.mp4,You don't want anything.,Neutral
70287222.mp4,Do you want anything?,Neutral
70287223.mp4,"I'll follow whatever, I don't care.",Neutral
70287124.mp4,"I'll read anything, I don't care.",Neutral
70287025.mp4,"No, I like anything, I don't care.",Neutral
70286926.mp4,"No, I can't believe he/she is guilty.",Neutral
70286827.mp4,I can't believe he/she is not guilty. I thought he/she was guilty.,Neutral
70286728.mp4,I can't believe John didn't buy the turkey.,Neutral
70286729.mp4,I can't believe it's not raining. I'm surprised.,Neutral
70286630.mp4,I can't believe there has not been a decision yet.,Neutral
70286531.mp4,"I doubt that the two of them have decided what to do yet, and I'm confused by that.",Negative
70286532.mp4,I think Obama will win again.,Positive
9799997.mp4,It's not raining outside right now.,Neutral
9799988.mp4,It hasn't rained recently.,Neutral
9799979.mp4,It's raining so much. Wow.,Positive
97999710.mp4,"Is it raining outside? No, because the temperature dropped, it's snowing.",Neutral
97999611.mp4,"It's not raining outside. Oh,wait a minute.",Neutral
97999512.mp4,"No, I didn't go.",Neutral
97999413.mp4,It wasn't me who started to open the can.,Neutral
97999314.mp4,The boy arrived home.,Neutral
97999315.mp4,John didn't buy the turkey.,Neutral
97999216.mp4,John broke the window.,Neutral
97999117.mp4,He/She isn't guilty.,Neutral
97999018.mp4,I'm not tired.,Neutral
97998919.mp4,I am very unhappy.,Neutral
97998920.mp4,I'm not happy.,Neutral
97998821.mp4,I don't want anything.,Neutral
97998722.mp4,He/She doesn't want anything?,Neutral
97998723.mp4,I doubt that he/she wants anything.,Neutral
97998624.mp4,He/she doesn't want anything? I doubt that. I think he/she wants something.,Neutral
97998525.mp4,He/She really feels nothing?,Neutral
97998426.mp4,The boy never goes home.,Neutral
97998327.mp4,Go home!,Neutral
97998228.mp4,The box is small.,Neutral
97998229.mp4,The box is not small.,Neutral
97998130.mp4,The box isn't small it's large.,Neutral
97998031.mp4,"The box isn't small, it's tiny.",Neutral
97998032.mp4,The box is really big.,Neutral
97997933.mp4,"The box is really big, it's not small.",Neutral
97997834.mp4,My pay increased a little bit.,Neutral
97997735.mp4,I start off warm and then later I get really hot.,Neutral
97997736.mp4,"I'm not warm, I'm hot.",Neutral
97997637.mp4,"I am not warm, I am cold!",Neutral
97997538.mp4,"No, I'm not happy.",Neutral
97997539.mp4,"I'm not happy, I'm sad.",Neutral
97997440.mp4,"Wow, I'm really tired.",Neutral
97997341.mp4,I'm not skilled.,Neutral
97997342.mp4,"Did I say John? Oh, I made that up. I meant James.",Neutral
97997243.mp4,"His name is not John...Wow, it's awful.",Neutral
97997144.mp4,John didn't buy the turkey.,Neutral
97997045.mp4,"John didn't buy the turkey, James did.",Neutral
97997046.mp4,"John didn't break the window, James did.",Neutral
97996947.mp4,"John didn't break the window, Sally did.",Neutral
97996848.mp4,I automatically keep information in the back of my mind.,Neutral
97996849.mp4,It doesn't matter to me. I like anything.,Neutral
97996750.mp4,That dog isn't mine.,Neutral
