video_name,caption,emotion
15716865.mp4,"The teacher is sick of always cleaning the classroom, so today he didn`t.",Negative
15716766.mp4,Mother is not sick today.,Neutral
15716667.mp4,Father is lazy so he refuses to mow the lawn.,Neutral
15716668.mp4,My aunt isn`t an expert at making apple pies.,Neutral
2817.mp4,How much is the television you just paid for?,Neutral
2818.mp4,Who just bought a car?,Neutral
2829.mp4,Who cooked dinner?,Neutral
28310.mp4,Where did you buy the car?,Neutral
28411.mp4,Where is the food store?,Neutral
28512.mp4,Where are you going now?,Neutral
28513.mp4,When do you finish work?,Neutral
28614.mp4,What are you currently working on?,Neutral
28715.mp4,Where are you putting the tree?,Neutral
28917.mp4,Mac beats PC because Mac is very compatible with people.,Neutral
28918.mp4,"Old music devices - records, CDs, tapes - no longer exist because everyone has iPods nowadays.",Neutral
29120.mp4,I love horror or comedy movies.,Neutral
29221.mp4,My mother wears glasses only because she knows she looks good in them.,Neutral
29322.mp4,My mother wears glasses because she thinks she looks cool in them.,Neutral
29424.mp4,"Throughout my high school years, my mother always had to wake me up because the alarm couldn`t.",Neutral
29727.mp4,I missed my morning class because I slept in.,Neutral
29728.mp4,"If it rains tomorrow, I will stay home.",Neutral
29829.mp4,"When I finish work, I will go home.",Neutral
29930.mp4,"If my computer breaks down, I tell Carol.",Neutral
30032.mp4,Have you bought the books?,Neutral
30133.mp4,Is the library closed?,Neutral
30134.mp4,Is it raining outside?,Neutral
30235.mp4,Did Donna give the money?,Neutral
30336.mp4,Is the water cold?,Neutral
30337.mp4,Is the movie good?,Neutral
30539.mp4,"Is it raining outside? No, it is beautiful.",Positive
30640.mp4,"Have I bought the book? No, I have not, but I will buy it tomorrow.",Neutral
30641.mp4,Mother finishes work at 2.,Neutral
30742.mp4,Where will the tree be put? Near the garage.,Neutral
84087.mp4,My friend drives.,Neutral
84099.mp4,I work.,Neutral
841010.mp4,My friend goes out fishing.,Neutral
841212.mp4,Now I am studying to go to school.,Neutral
841213.mp4,My friend travels.,Neutral
841415.mp4,My friend is calling home on the video phone.,Neutral
841516.mp4,My friend is surfing the web.,Neutral
841517.mp4,Did your friend drive?,Neutral
841719.mp4,Do you have to work all night?,Neutral
841922.mp4,When do you graduate?,Neutral
842023.mp4,Has your friend experienced travelling?,Neutral
842024.mp4,Is the video game easy to beat?,Neutral
842125.mp4,Is the video phone clear?,Neutral
842428.mp4,Who is driving?,Neutral
842429.mp4,Where is your friend driving to?,Neutral
842530.mp4,When did your friend start driving?,Neutral
842631.mp4,When does the party start?,Neutral
842732.mp4,What kind of a party is it?,Neutral
842733.mp4,When do you start work?,Neutral
842834.mp4,Why do you work all night?,Neutral
842935.mp4,Where do you work?,Neutral
843036.mp4,Who is going fishing?,Neutral
843037.mp4,When are your friends going fishing?,Neutral
843138.mp4,Who is planning to surprise Bob?,Neutral
843239.mp4,What time is the surprise party?,Positive
843240.mp4,Which high school did you go to?,Neutral
843341.mp4,When did you graduate high school?,Neutral
843342.mp4,Why don`t you like that video game?,Neutral
843544.mp4,When do you start travelling?,Neutral
843545.mp4,Where do you plan to travel?,Neutral
843646.mp4,Do you really need to video phone? Why not page?,Neutral
843747.mp4,Where is the video phone that you want?,Neutral
843848.mp4,Why is your friend addicted to the Internet?,Neutral
843849.mp4,What do you usually do on the Internet?,Neutral
843950.mp4,"If my friend is driving, I sleep in the back seat.",Neutral
844051.mp4,"When my friend is tired of driving, we will switch.",Neutral
844254.mp4,"If I arrive at work late, my boss will undoubtedly fire me.",Neutral
844559.mp4,"When Bob arrives at the party, everyone has to spray him with silly string and tease him.",Neutral
844660.mp4,"If I go to a public school, it is guaranteed that I won`t pay attention because there is no communication.",Neutral
844661.mp4,"When I arrive school, I have to text my mother to tell her I`ve arrived safely.",Neutral
844763.mp4,"When we arrive in India, I have to send my family a postcard thanking them for support.",Neutral
844965.mp4,"Once my father starts playing video games, I tend to go to my room because it`s boring to watch him and he doesn`t know how to play video games.",Neutral
845066.mp4,"When my friend calls me on the video phone, the lights flash on and off.",Neutral
845067.mp4,"When my friend is surfing the Internet, I remind him about his unfinished homework.",Neutral
845168.mp4,"If my friend finishes his homework early, he will surf the Internet all night.",Neutral
845269.mp4,My friend has to drive because I`m exhausted.,Neutral
845371.mp4,I work all night because I need the extra money.,Neutral
845777.mp4,My friend prefers video phone over texting because he can use ASL.,Neutral
557207.mp4,Mother has to go to the store because I need to go food shopping.,Neutral
557218.mp4,My friend left because she`s bored.,Neutral
5572210.mp4,"My friend is leaving when?  Uh, tomorrow.",Neutral
5572311.mp4,Father arrives home late because he had to finish work.,Neutral
5572514.mp4,"In my freshman year, my friends were shocked when they saw that I was bald because of the tradition at Gallaudet University.",Neutral
5572818.mp4,My neighbor just adopted puppies because they have children.,Neutral
734327.mp4,"If Mother goes to the store, she will buy milk.",Neutral
734338.mp4,"If mom doesn't walk to the store, we won't have milk.",Neutral
734349.mp4,"When Mother goes to the store, I`ll remind her to get us milk.",Neutral
7343611.mp4,"If my friends do not want to go out, I will stay home and watch television.",Neutral
7343612.mp4,"When my friends leave, I will finally start on my homework.",Neutral
7343713.mp4,"If father gets home late, (he/she) won't realize that he is not at home.",Neutral
7343814.mp4,If dad doesn't get home too late then he can help us with our homework.,Neutral
7344016.mp4,"When my father arrives home late, we tend to eat pizza for dinner.",Neutral
7344017.mp4,"If Father arrives home late, Mother will yell at him because the children wanted to see him.",Neutral
7344118.mp4,"When Father arrives home late, Mother refuses to make dinner.",Neutral
7344219.mp4,"If Father arrives home late, he can`t help us with our homework.",Neutral
7344320.mp4,"If the kids play at the park, they will be tired later in the afternoon.",Neutral
7344421.mp4,I will get a sunburn when I go swimming at the beach because I forgot sunscreen.,Neutral
7344422.mp4,"If I decide not to swim in the water, I will walk on the shore.",Neutral
7344523.mp4,"If I see that the beach is crowded, I would not want to go.",Neutral
7344624.mp4,I guarantee that the parents will be mad if the children dye their hair orange.,Neutral
7344725.mp4,"Once my friends start dying their hair, many more people will follow.",Neutral
7344726.mp4,"If Mother cleans the kitchen, it means we can`t bake cookies.",Neutral
7344827.mp4,"If Mother does not clean the kitchen, I have to do it myself.",Neutral
7344928.mp4,Mother will give me twenty dollars if I clean the kitchen.,Neutral
7345029.mp4,"When I finish cleaning the kitchen, mom will take me to my friends house.",Neutral
7345030.mp4,"If my friends go camping, I will go with them.",Neutral
7345131.mp4,"If Bob is successful at making a fire, I must stay and watch it to make sure it is maintained.",Positive
7345232.mp4,"When Bob starts the fire, we will collect logs to keep it going.",Neutral
7345233.mp4,"If my family decides not to adopt the puppies, my friend probably will.",Neutral
7345334.mp4,"If my family adopts the puppies, I will immediately go to the pet store to buy collars, of which they have assorted colors.",Neutral
771167.mp4,Mother went to the store.,Neutral
771138.mp4,Friends get together to go out.,Neutral
771089.mp4,Father arrived home late.,Neutral
7710510.mp4,Father arrived home late at night.,Neutral
7710211.mp4,The kid was playing at the park.,Neutral
7709712.mp4,I went swimming at the beach.,Neutral
7709113.mp4,Two friends dyed their hair together.,Neutral
7708714.mp4,Mother is cleaning the kitchen.,Neutral
7708415.mp4,My friend is going camping.,Neutral
7707516.mp4,A boy is making a bonfire.,Neutral
7707117.mp4,What the family adopted was puppies.,Neutral
7706918.mp4,Did Mother go to the store?,Neutral
7706619.mp4,Are the friends going out?,Neutral
7705720.mp4,Did father arrive home late last night?,Neutral
7705321.mp4,Did the kid play at the park?,Neutral
7687246.mp4,Mother walked to the store.,Neutral
7705122.mp4,Those friends went out together.,Neutral
7704723.mp4,Father arrived home late at night.,Neutral
7704424.mp4,The kid played in the park.,Neutral
7701925.mp4,I went swimming at the beach.,Neutral
7701526.mp4,Those two friends dyed their hair together.,Neutral
7700527.mp4,Mother cleaned the kitchen.,Neutral
7699929.mp4,A boy maintained the bonfire.,Neutral
7699730.mp4,The family adopted those puppies.,Neutral
7699131.mp4,Did Mother walk to the store?,Neutral
7698632.mp4,Have those two friends left?,Neutral
7698333.mp4,Did Father arrive home late at night?,Neutral
7698034.mp4,Did the kids play at the park?,Neutral
7692035.mp4,Did Barack Obama swim at the beach?,Neutral
7691736.mp4,Those friends dyed their hair together.,Neutral
7691537.mp4,Did Mother clean the kitchen?,Neutral
7691338.mp4,Did those friends go camping?,Neutral
7688839.mp4,Did the boy make the bonfire?,Neutral
7688440.mp4,Did the family adopt the puppies?,Neutral
7688041.mp4,Mother walked to the store.,Neutral
7687842.mp4,Those roommates went out together.,Neutral
7687743.mp4,Father arrived home late at night.,Neutral
7687544.mp4,The kids played at the park.,Neutral
7687345.mp4,Barack Obama swam at the beach.,Neutral
619057.mp4,"If Bob sends his resume, he is guaranteed the job.",Neutral
619048.mp4,"If the students listen to the teacher, they will learn something.",Neutral
619039.mp4,"If Bob gives his sweetheart a rose, she will be happy.",Positive
6190210.mp4,"If Bob studies for his literature test, he will pass it for sure.",Neutral
6190111.mp4,"When the teacher finishes cleaning the classroom, she must leave the key in the door.",Neutral
6190112.mp4,"If mother is sick, I have to take care of her.",Neutral
6190013.mp4,"If I mow the lawn, Mom will give me twenty dollars.",Neutral
6189914.mp4,"If my aunt makes a blue (starts signing 'pie') berry pie, I have to go over and eat it.",Neutral
6189815.mp4,"If I pay rent now, I will have to cancel my vacation.",Neutral
6189816.mp4,"When a bad storm comes to Boston, I have to stay home.",Negative
6189717.mp4,The family decided to have their annual vacation in Puerto Rico.,Neutral
6189618.mp4,"If Bob decides to adopt a big dog, he will have to accept the fact that he will spend lots of money on dog food.",Positive
6189519.mp4,"If Bob goes to the post office, I will give him my letters to drop off.",Neutral
6189520.mp4,"If the horse plays all day on the farm, it will fall asleep easily at night.",Positive
6189421.mp4,"If clothes are on sale, my friends and I will go over to the mall.",Neutral
6189322.mp4,Friends go to a different movie because they prefer action movies.,Neutral
6189223.mp4,"When I introduce a new friend, I will test and make sure he remembers the names.",Positive
6189124.mp4,"If my friend boldly asks for directions, I am willing to drive.",Positive
6189125.mp4,"If I commute to work by bike, then I'll have to wake up earlier.",Neutral
6189026.mp4,"If the baseball game has fireworks, I have to go.",Neutral
6188927.mp4,"If friends go to the beach and suntan, I have to bring sunscreen or else I will burn.",Neutral
6188928.mp4,"If friends play frisbee, I will  join them.",Positive
6188829.mp4,"I starting making an invitation list for my BBQ party, I will have to make sure it's right.",Positive
61829118.mp4,"When my sister goes water tubing, I will have to watch her and make sure to stop the boat when she falls off.",Neutral
6188730.mp4,"If he buys a plaid shirt, I will buy a striped shirt- I don't want the same shirt as him.",Neutral
6188731.mp4,"If I buy the shorts, I will have to return the shoes.",Neutral
6188632.mp4,"If my sister gets a headband for her birthday, she will decorate it.",Neutral
6188533.mp4,"When the bride and groom danced their last song at their wedding, everyone looked on quietly.",Neutral
6188534.mp4,"If I enjoy talking with those two, it means that I should enjoy talking with all of BU.",Positive
6188435.mp4,"When I move out of San Diego, I will have to get a new driver's license.",Neutral
6188336.mp4,"If your friend gets fucked up, I won't take care of him.",Negative
6188337.mp4,"Last night, I was drunk; everyone was cheering me on.",Neutral
6188238.mp4,"If my friend crashes the party, I will kick him out.",Positive
6188139.mp4,"If friends host a pizza party, I will bring a pizza with lots of toppings.",Positive
6188040.mp4,Bob hasn't sent the letter.,Neutral
6188041.mp4,The students refuse to listen to the teacher.,Neutral
6187942.mp4,Bob hasn't given the rose to his girlfriend.,Neutral
6187843.mp4,Bob hates reading books.,Neutral
6187844.mp4,"The teacher is sick of cleaning the classroom, so he didn't clean the room.",Negative
6187745.mp4,Mother isn't sick today.,Neutral
6187646.mp4,Father is lazy and refused to mow the lawn.,Negative
6187647.mp4,My aunt isn't good at making apple pies.,Neutral
6187548.mp4,I haven't paid rent.,Neutral
6187449.mp4,Good weather hasn't arrived in Boston. Hurry up!,Neutral
6187450.mp4,My family doesn't vacation every year anymore.,Neutral
6187351.mp4,Bob doesn't have a big dog- he only has a small dog.,Neutral
6187252.mp4,Bob hasn't gone to the post office.,Neutral
6187153.mp4,The horses hate the rain- they don't like running in the rain.,Negative
6187154.mp4,The clothes aren't on sale.,Neutral
6187055.mp4,The friends haven't arrived at the movie theater because of traffic.,Neutral
6186956.mp4,I am not good at remembering the names of new people.,Neutral
6186957.mp4,I hate asking for directions and then having to read lips and gestures to figure out the directions.,Negative
6186858.mp4,I hate commuting to work by bike.,Negative
6186859.mp4,I notice that babies hate fireworks. The fireworks scare the babies.,Negative
6186760.mp4,Friends haven't gone to the beach yet.,Neutral
6186661.mp4,Friends haven't started playing Frisbee.,Neutral
6186662.mp4,I decided not to invite Mary because she wouldn't get along with people.,Neutral
6186563.mp4,My sister hates water skiing because it's hard to balance.,Negative
6186464.mp4,My friend doesn't want to buy a plaid shirt.,Neutral
6186465.mp4,I don't want to buy shorts.,Neutral
6186366.mp4,My sister doesn't want a headband for her birthday.,Neutral
6186267.mp4,The bride and groom didn't dance.,Neutral
6186168.mp4,I didn't enjoy talking with those two.,Neutral
6186169.mp4,"I wasn't ready to move out of San Diego, so I stayed.",Neutral
6186070.mp4,"You didn't fuck up, did you?",Neutral
6185971.mp4,"You weren't passed out drunk, were you?",Neutral
6185972.mp4,Friends didn't crash the party.,Neutral
6185873.mp4,Friends didn't want a pizza night because they always have a pizza night.,Neutral
6185774.mp4,Who sent the letter?,Neutral
6185775.mp4,Who sent the letter?,Neutral
6185676.mp4,Who listens to the teacher?,Neutral
6185577.mp4,Who listens to the teacher?,Neutral
6185578.mp4,What did Bob give to his girlfriend?,Neutral
6185479.mp4,What is Bob reading?,Neutral
6185380.mp4,What time did the teacher clean the classroom?,Neutral
6185381.mp4,How did Mother get sick?,Negative
6185282.mp4,Who is sick?,Negative
6185183.mp4,Who is sick?,Negative
6185184.mp4,What is my aunt good at making?,Neutral
6185085.mp4,Who has to pay rent?,Neutral
6185086.mp4,Who has to pay rent?,Neutral
6184987.mp4,When is bad weather coming to Boston?,Negative
6184888.mp4,Where does your family tend to vacation every year?,Neutral
6184889.mp4,Who owns this big dog?,Neutral
6184790.mp4,Who owns this big dog?,Neutral
6184691.mp4,Who will go to the post office?,Neutral
6184592.mp4,Who will go to the post office?,Neutral
6184593.mp4,Where does the horse tend to play?,Neutral
6184494.mp4,Where are the clothes that are on sale?,Neutral
6184395.mp4,Who is joining the friends going to the movie theater?,Neutral
6184396.mp4,Who is he/she?,Neutral
6184297.mp4,Who is asking for directions?,Neutral
6184298.mp4,Who is asking for directions?,Neutral
6184199.mp4,Who commutes to work by bike?,Neutral
61840100.mp4,Who commutes to work by bike?,Neutral
61840101.mp4,Who loves watching fireworks?,Positive
61839102.mp4,Who loves watching fireworks?,Positive
61838103.mp4,Why are the friends going to the beach?,Neutral
61838104.mp4,Who wants to play frisbee?,Neutral
61837105.mp4,Who wants to play frisbee?,Neutral
61837106.mp4,Do you want to get together for a BBQ party?,Neutral
61836107.mp4,What time is water tubing?,Neutral
61835108.mp4,Does the friend reallhy want to buy the plaid shirt?,Positive
61835109.mp4,What do you need to buy?,Neutral
61834110.mp4,What does my sister want for her birthday?,Neutral
61834111.mp4,Why did the bride and groom dance at their wedding?,Neutral
61833112.mp4,Why do you talk with those two?,Neutral
61832113.mp4,Why do you have to move out of San Diego?,Neutral
61832114.mp4,Why does the friend look fucked up?,Neutral
61831115.mp4,Why did you pass out last night?,Neutral
61830116.mp4,What time did the friend crash the party?,Neutral
61830117.mp4,When is the pizza party that friend is hosting?,Positive
798767.mp4,"If it's raining tomorrow, I'll stay home.",Neutral
798768.mp4,"Once I finish work, I'm going home.",Neutral
798759.mp4,"When my computer breaks down and I don't know what to do, I'll ask someone for help.",Neutral
7987311.mp4,Did you buy a book?,Neutral
7987212.mp4,Is the library closed?,Neutral
7987213.mp4,Is it raining outside?,Neutral
7987114.mp4,Did Donna give you the money?,Neutral
7987015.mp4,Is the water cold?,Neutral
7986916.mp4,Was the movie good?,Neutral
7986719.mp4,"Did I buy the book yet? No, I will buy it tomorrow.",Neutral
7986620.mp4,What time does mom finish work? At 2pm.,Neutral
7986521.mp4,Where should the tree be? Next to the garage.,Neutral
7986522.mp4,Bob sent a letter.,Neutral
7986423.mp4,The students listen to the teacher.,Neutral
7986225.mp4,Bob read a book.,Neutral
7986126.mp4,The teacher cleans the classroom.,Neutral
7985928.mp4,Father is mowing the grass.,Neutral
7985829.mp4,My aunt is making blueberry pie.,Neutral
7985830.mp4,I need to pay rent.,Neutral
7985632.mp4,My family goes on vacation every year.,Neutral
7985533.mp4,Bob has a big dog.,Neutral
7985534.mp4,Bob went to the post office.,Neutral
7985435.mp4,The horses played on the farm.,Neutral
7985336.mp4,The clothes are on sale.,Neutral
7985337.mp4,Friends go out to the movie theater.,Neutral
7985038.mp4,I am introducing you to a new friend.,Neutral
7985039.mp4,Ask for directions. Where do I go?,Neutral
7984940.mp4,I commute to work by bike.,Neutral
7984841.mp4,I like fireworks.,Neutral
7984742.mp4,Friends go together to the beach to lay out in the sun and tan.,Neutral
7984545.mp4,My sister went water tubing.,Neutral
7984546.mp4,My friend wanted to buy a plaid shirt.,Neutral
7984447.mp4,I need to buy shorts.,Neutral
7984348.mp4,My sister wants a headband for her birthday.,Neutral
7984249.mp4,The bride and groom ended their wedding with a dance.,Neutral
7984250.mp4,I enjoyed talking with the two of them.,Positive
7984151.mp4,I moved out of San Diego.,Neutral
7984052.mp4,Your friend is messed up. He looks awful.,Neutral
7984053.mp4,I was drunk last night.,Neutral
7983855.mp4,Friends hosted a pizza dinner.,Neutral
7983756.mp4,Did Bob send the letter?,Neutral
7983757.mp4,Did the students really listen to the teacher?,Neutral
7983559.mp4,Does Bob like reading books?,Neutral
7983560.mp4,Did the teacher clean the classroom?,Neutral
7983362.mp4,Did dad mow the lawn?,Neutral
7983264.mp4,Did I already pay the rent?,Neutral
7983166.mp4,Does your family go on vacation every year?,Neutral
7983067.mp4,Does Bob have a big dog?,Neutral
7982968.mp4,Did Bob arrive at the post office?,Neutral
7982969.mp4,Is that the only one horse playing on the farm?,Neutral
7982870.mp4,Are the clothes on sale?,Neutral
7982771.mp4,Did the group of friends arrive at the movie theater?,Neutral
7982772.mp4,Have you met my new friend?,Neutral
7982673.mp4,Do you know where to go?,Neutral
7982574.mp4,Do you commute to work by bike?,Neutral
7982575.mp4,Do you like fireworks?,Neutral
7982476.mp4,Is it healthy to lay out and tan?,Neutral
7982378.mp4,Should I host a barbeque party?,Neutral
7982279.mp4,Does your sister like water tubing?,Neutral
7982180.mp4,Do I look good in this plaid shirt?,Neutral
7982081.mp4,Should I buy shorts?,Neutral
7982082.mp4,Does my sister want a headband for her birthday?,Neutral
7981983.mp4,Did the bride and groom like their wedding?,Neutral
7981884.mp4,Do you enjoy talking with them two?,Neutral
7981885.mp4,Did you already move to San Diego?,Neutral
7981786.mp4,Was your friend messed up?,Neutral
7981688.mp4,Will you host a pizza dinner?,Neutral
7981391.mp4,The students must learn to listen to the teacher because the teacher is in charge.,Neutral
7981292.mp4,Bob gave a rose to his wife because it's their anniversary today.,Neutral
7981293.mp4,Bob loves reading books because he can visualize what happens in the stories.,Positive
7981095.mp4,Mom is sick because she recently took care of her sick friend.,Neutral
7981096.mp4,Father must mow the lawn soon because we are having a barbeque party.,Neutral
7980997.mp4,My aunt is an expert at making blue berry pies because she grew up making them.,Neutral
79807100.mp4,My family vacation every year is in Florida because everyone loves the sun.,Positive
79806101.mp4,Bob has a big dog because he loves to wrestle with it.,Positive
79805102.mp4,Bob needs to go to the post office to buy stamps.,Neutral
79805103.mp4,The horse runs on the farm because it can't race.,Neutral
79804104.mp4,The clothes are on sale because they used to be expensive.,Neutral
79803105.mp4,The group of friends go to the movie theater together to see Harry Potter 7 that just came out.,Neutral
79803106.mp4,I introduced you to my new friend because he seemed lonely.,Neutral
79802107.mp4,Ask for directions because I don't know where to go.,Neutral
79801108.mp4,I commute to work by bike because I can't afford a car.,Neutral
79797115.mp4,I need to buy shorts because it's hot outside.,Neutral
79796116.mp4,My sister wants a headband for her birthday because her hair is long and she wants a headband to keep it in place.,Neutral
79795117.mp4,The bride and groom danced at their wedding by picking their song.,Neutral
79795118.mp4,I enjoyed chatting with those two because we talked about ASL.,Positive
79794119.mp4,I'm moving to San Diego because I got a new job offer.,Neutral
79793120.mp4,My friend was f**ked up last night because he drank too much.,Neutral
79793121.mp4,My friend was passed out drunk because he drank too much on his birthday.,Neutral
5873537.mp4,It's raining and it's impossible to find an umbrella.,Neutral
5873519.mp4,It's raining and it's impossible to find an umbrella.,Neutral
58735010.mp4,"After not studying, there's always a pop quiz.",Neutral
58734514.mp4,Why didn't you buy car insurance?,Neutral
58734415.mp4,He will buy flowers for sure.,Neutral
58734316.mp4,He will buy flowers for sure.,Neutral
58734218.mp4,Who buys flowers?,Neutral
58734119.mp4,Who bought flowers?,Neutral
58733921.mp4,I don't even have one dollar!,Neutral
58733822.mp4,I have no money.,Neutral
58733723.mp4,"When I don't have money, I tend to go to my aunt's and eat there.",Neutral
58733724.mp4,"If I don't have a book to read, I get bored.",Neutral
58733625.mp4,"When it's near the end of the semester, it's impossible to hang out.",Neutral
58733427.mp4,I wish John and Mary will stop being in a relationship after seeing John play with her.,Neutral
58733328.mp4,"If you win the lottery, we are going to Jamaica.",Positive
17088.mp4,There's no homework today.,Neutral
17099.mp4,Mary is a vegetarian.,Neutral
171010.mp4,Mom likes surprises.,Positive
171112.mp4,Mary isn't a vegetarian.,Neutral
171213.mp4,The weather's not lousy today.,Neutral
171314.mp4,Mom hates surprises.,Neutral
171415.mp4,The weather isn't beautiful today. Oh well.,Neutral
171516.mp4,I do like pineapple cream cheese.,Neutral
171617.mp4,Why isnt't there any pineapple cream cheese?,Neutral
171618.mp4,Your sister doesn't like pineapple cream cheese.,Neutral
171719.mp4,"Hey wait, I do like pineapple cream cheese!",Neutral
171921.mp4,I don't like pineapple cream cheese.,Neutral
172123.mp4,"If it has pineapple cream cheese on it, I won't eat the bagel.",Neutral
172124.mp4,"When it has pineapple cream cheese on it, he won't eat the bagel.",Neutral
172225.mp4,I like chocolate cereal.,Neutral
172326.mp4,Why isn't there any chocolate cereal?,Neutral
172327.mp4,My sister doesn't like chocolate cereal.,Neutral
172428.mp4,Hey! I like chocolate cereal.,Neutral
172631.mp4,"No, I don't like chocolate cereal.",Neutral
172833.mp4,"No, the car's not broken.",Neutral
172934.mp4,"The car's not broken, there's just no gas.",Neutral
172935.mp4,"The car isn't broken, you're using the wrong key.",Neutral
173137.mp4,The car has a full tank of gas.,Neutral
173238.mp4,"No, I used the right key.",Neutral
173239.mp4,"No, that car isn't broken, the truck is broken.",Neutral
173644.mp4,The car did not breakdown.,Neutral
173746.mp4,The car didn't breakdown.,Neutral
173847.mp4,"No, the car didn't break down.",Neutral
173948.mp4,"No, the car didn't breakdown.",Neutral
174051.mp4,John got Mary and drove her to work.,Neutral
174152.mp4,John took Mary and drove her to work every day.,Neutral
