video_name,caption,emotion
97996651.mp4,Mary stopped rowing. She's not going to do it any more.,Neutral
97996552.mp4,"No, he/she didn't stop.",Neutral
97996453.mp4,"Did Mary stop rowing? No, she's never rowed until now.",Neutral
97996454.mp4,"Did John read that book? No, he never started it.",Neutral
97996355.mp4,I'm not.,Neutral
97996256.mp4,"I didn't see the accident, I was asleep.",Neutral
97996257.mp4,John didn't see me.,Neutral
97996158.mp4,I didn't wash my clothes.,Neutral
97996059.mp4,He/She didn't finish because he/she was laying around.,Neutral
97967.mp4,I can never find an umbrella when it rains.,Neutral
97958.mp4,There is always a pop quiz on the days I choose not to study.,Neutral
97959.mp4,If it happens to rain I won't have an umbrella.,Neutral
979410.mp4,"When I don't study, there is always a pop quiz.",Neutral
979311.mp4,"If I don't study, I will fail.",Negative
979212.mp4,"If I don't study, I will fail.",Negative
979213.mp4,"If I don't study, I will fail.",Negative
979114.mp4,Why didn't you buy car insurance?,Neutral
979015.mp4,"He/She will buy flowers for you, for sure.",Neutral
978916.mp4,He/She will for sure give him/her flowers.,Neutral
978817.mp4,Where do we go if there's an emergency?,Neutral
978818.mp4,Who bought the flowers?,Neutral
978719.mp4,Who bought the flowers?,Neutral
978620.mp4,"Even if you make only one tiny mistake, it will be tossed out.",Neutral
978521.mp4,I don't even have one dollar.,Neutral
978522.mp4,I don't have any money.,Neutral
978423.mp4,"If I don't have any money, I go to my aunt's house and eat there.",Neutral
978324.mp4,"If I don't read, I will be bored.",Neutral
978225.mp4,"Near the end of the semester, I cannot socialize as much.",Neutral
978126.mp4,What is that for?,Neutral
978027.mp4,"If John did that to me, we would have broken it off a long time ago.",Neutral
977928.mp4,John has been treating Mary awfully and I just want her to break up with him.,Neutral
977929.mp4,"If you win the lottery, will you go to Jamaica?",Positive
4038707.mp4,"If you study consistently, you will ace the class.",Neutral
4038698.mp4,The train may be late if it's raining.,Neutral
4038689.mp4,If there is warm weather then there won't be snow.,Neutral
40386710.mp4,"If you work hard, the boss will like you.",Neutral
40386611.mp4,"If mom comes, I have to clean the house.",Neutral
40386512.mp4,If you plan ahead of time you can save money.,Neutral
40386513.mp4,Do you like work?,Neutral
40386414.mp4,Do you like class?,Neutral
40386315.mp4,Are you going to school tomorrow?,Neutral
40386216.mp4,Do you have class tomorrow?,Neutral
40386117.mp4,Are you watching the football game?,Neutral
40386018.mp4,Are you hot or cold?,Neutral
40386019.mp4,Who does he/she like?,Neutral
7578507.mp4,Farms like the hot summers because it's easy to grow big vegetables.,Positive
7578498.mp4,"Sorry, the black shoes are gone.",Neutral
7578489.mp4,I like Land O' Lakes butter.,Neutral
75784810.mp4,"I'm sorry, you have to wait. Sit over there.",Neutral
75784711.mp4,John and Mary have a strange bike. Two people can ride on it.,Neutral
75784612.mp4,I used to lie but I don't anymore. I regret lying.,Neutral
75784513.mp4,My nephew has strange shoes that have red blinking lights.,Neutral
75784414.mp4,The name of the farm is Roberts Ranch.,Neutral
75784415.mp4,"On hot summer days, Mary loves drinking lemonade.",Positive
75784316.mp4,John doesn't have special biking shoes.,Neutral
75784217.mp4,The doctor told me that Mom was acting strange and that she better go to the hospital and stay overnight.,Neutral
75784118.mp4,Does the library lend out magazines?,Neutral
75784019.mp4,Yesterday I was on the bus and a strange man sat next to me and started talking. I just stared at him.,Neutral
75784020.mp4,"Next week, Paul will be very busy. He works as an interpreter all day and takes night classes.",Neutral
75783921.mp4,Mary likes margarine but she doesn't like butter.,Neutral
75783822.mp4,"Sorry, the store doesn't sell funny books.",Neutral
75783723.mp4,I told Dan that when he inteprets he has to stand; he can't sit.,Neutral
75783724.mp4,John is a really good liar. I fell for everything he said. I'm sick of him.,Negative
75783625.mp4,It's weird because Mary told me she would be home around midnight but I think she won't get home until three in the morning.,Neutral
75783526.mp4,Is today a good day?,Neutral
75783427.mp4,My son told me that he prefers black pants.,Neutral
75783328.mp4,Mary goes to the farm to buy fresh butter.,Neutral
75783329.mp4,"I didn't know that I was not allowed to sit on the table, I'm sorry.",Neutral
75783230.mp4,"If an interpreter comes, it will be a strange situation.",Neutral
75783131.mp4,Are you going to interpret tomorrow at the library?,Neutral
75783032.mp4,Paul told me he can't interpret because his car broke down.,Neutral
75783033.mp4,My brother works nights.,Neutral
1194707.mp4,"Stop lying, it's not funny. Where's mom?",Negative
1194698.mp4,I want butter.,Neutral
1194689.mp4,I want that black book.,Neutral
11946810.mp4,Father watched the boy smirk and it didn't seem like the boy was sorry.,Neutral
11946711.mp4,Mother is deaf and sometimes her daughter interprets for her.,Neutral
11946612.mp4,"Sorry, the library doesn't let you borrow magazines. You have to stay here and read them.",Neutral
11946513.mp4,The black bike is better but the red bike is cheaper.,Neutral
11946414.mp4,"If it's cold, my mom won't go out.",Neutral
11946415.mp4,Mother suspected that the boy was lying.,Negative
11946316.mp4,The teacher didn't tell me class was cancelled so I went and sat there waiting for about twenty minutes.,Neutral
11946217.mp4,Mary likes red shoes.,Neutral
11946118.mp4,"Now that it's cold, I need better shoes.",Neutral
11946119.mp4,Do you want to go out and buy shoes?,Neutral
11946020.mp4,Was the movie Election any good? Is it funny?,Positive
11945921.mp4,"That movie, Election, is weird but it's funny.",Positive
11945922.mp4,John works nights.,Neutral
11945823.mp4,My son wants to be an interpreter.,Neutral
11945724.mp4,"If I have a baby, I want an Irish name but the father wants a French name.",Neutral
11945625.mp4,"If I have a baby, I want to give it an Irish name but the father wants to give it an Italian name.",Neutral
11945626.mp4,I sat and worked all day.,Neutral
11945527.mp4,The mother and the boy are both going to the library.,Neutral
11945428.mp4,Mary is funny. She really wants an ugly dog.,Neutral
5886737.mp4,John works at the library.,Neutral
5886728.mp4,"Joe is a good interpreter, but he isn't proficient.",Neutral
5886719.mp4,Do you want butter?,Neutral
58867010.mp4,The boy's bike crashed and he fell off.,Neutral
58866911.mp4,Wearing black clothes in the summer will make you hot.,Neutral
58866812.mp4,"When it's cold outside, I love drinking hot chocolate.",Positive
58866813.mp4,"If it's hot out, John will go to the library and read a magazine because there is air conditioning in the library.",Neutral
58866714.mp4,The library has a lot of magazines.,Neutral
58866615.mp4,Bob works at the bike store.,Neutral
58866516.mp4,John is going to the library to read a good book.,Neutral
58866417.mp4,"If you are going to interpret, you must wear black clothes.",Neutral
58866318.mp4,Good night,Neutral
58866319.mp4,I like that boy. He's funny.,Positive
58866220.mp4,"Mother's name is Jane, not Janet.",Neutral
58866121.mp4,The boy wants new shoes.,Neutral
58866022.mp4,"The soup, gazpacho soup, is cold not hot.",Neutral
58865923.mp4,"Dad is funny, but Mom is serious.",Neutral
58865924.mp4,The boy lied and blamed the dog.,Negative
58865825.mp4,Do you think People magazine is any good?,Neutral
58865726.mp4,I lied and told my wife that her mom's food was good when really it wasn't.,Neutral
2682829.mp4,"No, the car didn't break down.",Neutral
26828110.mp4,The car didn't break down. Maybe it ran out of gas.,Neutral
26828011.mp4,The car isn't broken. Are you using the wrong key?,Neutral
26828012.mp4,"Yes, the car is broken down.",Neutral
26827913.mp4,"The car has gas, I already checked.",Neutral
26827814.mp4,I have the right key for the car.,Neutral
26827715.mp4,"The car didn't break down, the truck did.",Neutral
26827518.mp4,"Yes, the car really is broken down.",Neutral
26827320.mp4,"No, the car is not broken.",Neutral
26827222.mp4,The car didn`t break down.,Neutral
26827123.mp4,"No, the car is not broken.",Neutral
26827024.mp4,The car didn't break down.,Neutral
26826925.mp4,Mary's car broke down. It's fine because John will drive her to work.,Neutral
26826826.mp4,"When Mary's car breaks down, John usually gives her a ride to work.",Neutral
26826827.mp4,John drives Mary to work.,Neutral
26826628.mp4,John drives Mary to work everyday.,Neutral
26826629.mp4,"In the past, John usually drove Mary to work.",Neutral
26826530.mp4,"Everyday, John drives Mary to work.",Neutral
26826431.mp4,John will drive Mary to work.,Neutral
26826332.mp4,"Does John drive Mary to work? No, he usually drives Amy to work.",Neutral
26826333.mp4,"John drives Mary to school, not work.",Neutral
26826234.mp4,"When John goes with Mary, they don't drive. They walk to work.",Neutral
26826135.mp4,It's not raining.,Neutral
26826136.mp4,It didn't even rain a little bit.,Neutral
26826037.mp4,I'm surprised. I can't believe it's not raining. I wonder why.,Neutral
36298783.mp4,There is no homework today.,Neutral
36297784.mp4,Mary is a vegetarian.,Neutral
36297785.mp4,Mom likes surprises.,Positive
36296786.mp4,The weather today is beautiful.,Positive
36296787.mp4,"No, Mary is not a vegetarian.",Neutral
36295788.mp4,"The weather today isn't lousy, it's fine.",Neutral
36294791.mp4,I like pineapple cream cheese.,Neutral
36293792.mp4,Why isn't there any pineapple cream cheese?,Neutral
36293793.mp4,"No, your sister doesn't like pineapple cream cheese.",Neutral
36292795.mp4,My father and I are alike. We both like pineapple cream cheese.,Neutral
36291797.mp4,I prefer lox cream cheese.,Neutral
36290798.mp4,If that is pineapple cream cheese then I won't eat the bagel.,Neutral
36290799.mp4,I agree with you. If that's pineapple cream cheese then I won't eat the bagel.,Neutral
36289800.mp4,I like chocolate cereal but there isn't any. Why is that?,Neutral
36289801.mp4,The sister doesn't like chocolate cereal.,Neutral
36288802.mp4,Dad likes chocolate cereal.,Neutral
36287804.mp4,"No, I don't like chocolate cereal.",Neutral
559807.mp4,"""We will serve peanut butter to everyone that likes it."" ""No, Beth is allergic to peanut butter. She can't eat it so we can't serve it.""",Neutral
559798.mp4,"""It never snows here in Boston."" ""Yes, it snows a lot in Boston. Have you spent a winter here before?""",Neutral
559799.mp4,"""You are afraid of heights, right?"" ""No, I'm not afraid of heights. Why would you think that?",Neutral
5597810.mp4,"""The water I drank tasted funny."" ""No it tastes normal to me.""",Neutral
5597711.mp4,"""Pete doesn't know how to use a computer."" ""No, Pete is a genius. He has three computers at home.""",Neutral
5597612.mp4,"""He/she shouldn't go to the baseball game because it's going to rain."" ""No, it's not going to rain, and even if it did, the baseball game wouldn't be cancelled.""",Neutral
5597513.mp4,"""I suggest that you don`t fly with American Airlines because their plane tickets are expensive.""  ""No. Well, yes, they are probably expensive but if they are really expensive, I`m stuck because they are the only one with a direct flight from Boston to Miami.""",Neutral
5597414.mp4,"“Don`t eat cookies with butter.” “Well, I like cookies, but if they have butter, I still don`t care.”",Neutral
5597315.mp4,"You'll see Mary at the party. Would you tell her to call me?"" ""I doubt that I'll be going out but if I see her I will tell her to call you.""",Neutral
5597316.mp4,Someone bought the car. Who was it?,Neutral
5597217.mp4,Who bought the car?,Neutral
5597118.mp4,Who found my keys?,Neutral
5597019.mp4,Does the party tonight start at 8 or 9?,Neutral
5596920.mp4,You look like you don't feel good. Are you okay - what's wrong?,Neutral
5596921.mp4,What kind of car did you buy yesterday?,Neutral
5596822.mp4,Who arrived late?,Neutral
5596723.mp4,Which college does Mary go to?,Neutral
5596624.mp4,Who loves Bill?,Positive
5596525.mp4,Is Bill planning on moving to New York?,Neutral
5596426.mp4,Do you like Boston?,Neutral
5596327.mp4,Where did Sue move?,Neutral
5596229.mp4,Who is Liz's famous sister?,Neutral
5596130.mp4,How many children does Phil have?,Neutral
5596031.mp4,Did Jack and Sue already meet?,Neutral
5595932.mp4,Does Jack have money?,Neutral
5595933.mp4,"When Jack went out, did he see something strange?",Neutral
5595834.mp4,Did someone win the lottery?,Positive
5595735.mp4,Would the game finish before six?,Neutral
5595636.mp4,Are Jen and Joe married?,Neutral
154117.mp4,"""Did your roommate get arrested last night?"" ""No, I was at breakfast this morning he/she was fine.""",Neutral
154099.mp4,"""There's no homework for History class right?"" ""No, we have homework, We have to write a three page paper.""",Neutral
1540810.mp4,"""Mary is a vegetarian isn't she?"" ""No, she had a bbq last month.""",Neutral
1539329.mp4,"""Today is the last day of the semester right?"" ""No next week is. We still have one more week of class.""",Neutral
1540711.mp4,"""The cafeteria is serving ice cream tonight."" ""No, I just came from there and there wasn't any ice cream.""",Neutral
1540514.mp4,"""Hey, I may be late for the movie."" ""No, it's fine, you have time; the movie starts at 10pm.""",Neutral
1540415.mp4,"""Hey last night John Stewart interviewed Sarah Jessica Parker."" ""No, he didn't interview her he interviewed Sarah Palin.""",Neutral
1539230.mp4,"""Your uncle lives in a big house right?"" ""No, he lives in a small apartment.""",Neutral
1540316.mp4,"""Did you finish your homework."" ""No, I haven't even started yet.",Neutral
1540317.mp4,"""You're going to run in the Boston Marathon right?"" ""No I haven't ran and I don't plan on starting""",Neutral
1540218.mp4,"""Did you vote for George Bush?"" ""No, I wasn't even old enough to vote when he ran for office.""",Neutral
1540119.mp4,"""Tomorrow is Sunday."" ""No, today is Thursday which means tomorrow is Friday.""",Neutral
1540020.mp4,"""You're going to Hawaii for Christmas break ?"" ""No, I'm going to Hawaii for Spring break.""",Neutral
1539922.mp4,"""Rick Perry is a Mormon."" ""No, Mitt Romney is a Mormon, not Rick Perry.""",Neutral
1539823.mp4,"""The table over there has a book that someone left."" ""No there is no table over there or a book.""",Neutral
1539724.mp4,"""Did someone finally find your umbrella?"" ""No, it's still missing.""",Neutral
1539626.mp4,"""No matter what the weather is, the baseball game will go on."" ""Well, yes, but if there is a hurricane it will be cancelled.""",Neutral
1539527.mp4,"“Mayor Bloomberg is around six feet tall or more.” “No, he`s short; he`s maybe five feet six inches, that`s all.”",Neutral
1539428.mp4,“The economy now is great! It`s fine.” “No! It`s really messed up now.”,Neutral
17601178.mp4,My boss works in an office right above me.,Neutral
17601179.mp4,I got a D in the class; I accepted it.,Neutral
17600180.mp4,My sister blamed me but I am innocent!,Neutral
17600181.mp4,I tend to exercise after class.,Neutral
17599182.mp4,I noticed my sister acting strange.,Neutral
17599183.mp4,I watched a movie last night and the actor was good.,Neutral
17597186.mp4,I asked my teacher for some advice and we had a discussion.,Neutral
17596187.mp4,My teacher is a good advisior.,Neutral
17595189.mp4,This afternoon I'm going to the store.,Neutral
17595190.mp4,I have to take the test again.,Neutral
17594191.mp4,My mom is getting old.,Neutral
17593192.mp4,Age isn't important.,Neutral
17589200.mp4,"Last break, I completed all of my homework ahead of time.",Neutral
17590199.mp4,Yesterday I worked all day.,Neutral
17592195.mp4,Last night I did a lot of homework.,Neutral
17591196.mp4,I'm almost finished with my homework.,Neutral
17591197.mp4,I'm always serious in school.,Neutral
17588202.mp4,My ancestors are from Germany.,Neutral
17587203.mp4,There's not many animals here in Boston.,Neutral
17587204.mp4,My other friends joined me last night.,Neutral
17586205.mp4,The teacher gave out the answers to the test.,Neutral
17585207.mp4,I volunteer to help other organizations.,Neutral
17584209.mp4,They assigned me many tasks.,Neutral
17583210.mp4,I have an appointment this afternoon with my teacher.,Neutral
17583211.mp4,I have to discuss how I should approach the teacher appropriately.,Neutral
423147.mp4,I haven`t yet paid rent.,Neutral
423148.mp4,Good weather has not arrived in Boston… Hurry up!,Neutral
423159.mp4,My family does not vacation every year any more.,Neutral
4231610.mp4,Bob does not have a big dog; he has a small one.,Neutral
4231711.mp4,Bob hasn't gone to the post office yet.,Neutral
4231712.mp4,The horses do not like running in the rain.,Neutral
4231813.mp4,The horses running on the farm hate when it rains,Negative
4231914.mp4,The clothes are not on sale.,Neutral
4232015.mp4,The friends have not gone to the theater because of traffic.,Neutral
4232116.mp4,I am not good at memorizing names of people I`ve already met.,Neutral
4232117.mp4,When I meet new people I`m lousy at memorizing their names.,Negative
4232218.mp4,I don`t like asking for directions.,Neutral
4232319.mp4,"Honestly, I don`t like commuting to work by bicycle.",Positive
4232320.mp4,That baby doesn`t like fireworks; it`s crying.,Neutral
4232421.mp4,The friends have not gone to the beach.,Neutral
4232522.mp4,The friends have not played Frisbee.,Neutral
4232623.mp4,I have decided not to invite Mary because she doesn`t get along with that crowd.,Neutral
4232624.mp4,My sister hates water skiing because it is hard to balance.,Negative
4232725.mp4,My friend doesn`t want to buy a plaid shirt.,Positive
4232826.mp4,I don`t want to buy shorts.,Neutral
4232927.mp4,My sister doesn`t want a headband for her birthday.,Neutral
4233028.mp4,The bride and groom didn`t dance the last dance at the wedding.,Neutral
4233129.mp4,I didn`t enjoy talking to Donna and Jessica.,Neutral
4236881.mp4,I'm not going to move out to San Diego because I'm not even ready.,Neutral
4233130.mp4,Did you not pass out?,Neutral
4233231.mp4,You didn't pass out?,Neutral
4233332.mp4,My friends talked and decided not to crash the party.,Positive
4233433.mp4,My friends realized they didn`t want a pizza party because it has been the norm.,Positive
4233434.mp4,Who did you send the letter to?,Neutral
4233535.mp4,Who sent the letter?,Neutral
4233636.mp4,Who listened to the teacher?,Neutral
4233637.mp4,Who listened to the teacher?,Neutral
4233738.mp4,What did Bob give his girlfriend?,Neutral
4233839.mp4,What did Bob read?,Neutral
4233840.mp4,What time did the teacher start cleaning?,Neutral
4233941.mp4,Mother looks sick? How?,Negative
4234042.mp4,Who is sick?,Negative
4234143.mp4,Who is sick?,Negative
4234144.mp4,What is my aunt an expert at making?,Neutral
4234245.mp4,Who has to pay rent?,Neutral
4234346.mp4,Who is paying rent?,Neutral
4234447.mp4,Who has to pay rent?,Neutral
4234448.mp4,When does the bad weather start in Boston?,Negative
4234549.mp4,Where does your family tend to vacation?,Neutral
4234650.mp4,Who owns that big dog?,Neutral
4234751.mp4,Who owns that big dog?,Neutral
4234752.mp4,Will you go to the post office? Who will?,Neutral
4234853.mp4,Who is going to the post office?,Neutral
4234954.mp4,Where do the horses tend to play?,Neutral
4235055.mp4,Where are the clothes on sale?,Neutral
4235056.mp4,Who will join the friends` outing to the movie theater?,Positive
4235157.mp4,Who is that person?,Neutral
4235258.mp4,Who is asking for directions?,Neutral
4235359.mp4,Who is asking for directions?,Neutral
4235360.mp4,Who tends to commute to work by bicycle?,Neutral
4235461.mp4,Who tends to commute to work by bicycle?,Neutral
4235562.mp4,Who loves to watch fireworks?,Positive
4235563.mp4,Who loves to watch fireworks?,Positive
4235664.mp4,Who loves watching fireworks?,Positive
4235765.mp4,Why are friends going to the beach?,Neutral
4235866.mp4,Who wants to play Frisbee?,Neutral
4235867.mp4,Who wants to play Frisbee?,Neutral
4235968.mp4,When do you want the BBQ to be?,Neutral
4236069.mp4,Why do you want the BBQ?,Neutral
4236070.mp4,What time are we going tubing?,Neutral
4236171.mp4,My friend wants to buy a plaid shirt.,Neutral
4236272.mp4,What do you have to buy?,Neutral
4236273.mp4,What does my sister want for her birthday?,Neutral
4236374.mp4,Why did the bride and groom end the wedding?,Neutral
4236475.mp4,Do you usually talk with Jessica and Donna? What? Why?,Neutral
4236576.mp4,Why do you have to move to San Diego?,Neutral
4236577.mp4,Why does that friend look like he`s going to pass out?,Positive
4236678.mp4,Why did you drink hard and pass out last night?,Neutral
4236779.mp4,What time did my friend crash the party?,Neutral
4236780.mp4,When is the pizza party that my friend is hosting?,Positive
1572107.mp4,I had to ask for directions because I had no idea where to go.,Neutral
1572098.mp4,I commute to work by bicycle because I can`t afford a car.,Neutral
1572089.mp4,I love fireworks because they`re beautiful and loud.,Positive
15720710.mp4,Friends go to the beach to sunbathe because they are pale.,Neutral
15720711.mp4,My friends tend to play Frisbee at the park.,Positive
15720612.mp4,I invited my friend to a BBQ because it`s Fourth of July soon.,Neutral
15720513.mp4,My sister prefers tubing rather than water skiing because tubing is easier.,Neutral
15720414.mp4,My friend wanted a plaid shirt because there will be a formal party soon.,Positive
15720415.mp4,I have to buy shorts because it is hot outside.,Neutral
15720316.mp4,My sister wants a headband for her birthday because she has long hair.,Neutral
15720217.mp4,The bride and groom danced their last dance before the wedding ended with their own choice of a song.,Neutral
15720218.mp4,I enjoyed talking with Jessica and Donna because I enjoy talking in ASL.,Positive
15720119.mp4,I moved to San Diego because of a new job offer.,Neutral
15720020.mp4,"Last night, my friend passed out because he drank too much.",Neutral
15719921.mp4,My friend passed out last night because he drank too much.,Neutral
15719922.mp4,My friend passed out last night because it was his birthday.,Neutral
15719823.mp4,My friend crashed the party because he had just finished his final exam.,Positive
15719724.mp4,My friend hosted a pizza party because he loves pizza.,Positive
15719625.mp4,"If Bob sends his resume, he will get the job.",Neutral
15719526.mp4,"If the students listen to their teacher, they will learn something.",Neutral
15719527.mp4,"If Bob gives his girlfriend roses, she will be happy.",Positive
15719428.mp4,"If Bob studies literature, he will pass his final exam.",Neutral
15719329.mp4,"When the teacher finishes cleaning the classroom, he locks the door.",Neutral
15719230.mp4,"If Mother is sick, I have to take care of her.",Neutral
15719231.mp4,"If I mow the lawn, Mother will give me twenty dollars.",Neutral
15719132.mp4,"If my aunt makes a blueberry pie, I will run home to gobble all of it up!",Neutral
15719033.mp4,"If I have to pay rent now, that is fine, I'll just cancel my vacation.",Neutral
15718934.mp4,"When a bad storm comes to Boston, I will stay home.",Negative
15718935.mp4,"If my family decides to vacation every year, they will go to Puerto Rico.",Neutral
15718836.mp4,"If Bob adopts a big dog, he has to accept that he will spend lots of money on the dog.",Positive
15718737.mp4,"If Bob goes to the post office, I will give him all of my mail so he can drop it off.",Neutral
15718738.mp4,"If the horses play all day on the farm, by nighttime they will be exhausted.",Neutral
15718639.mp4,"If clothes are on sale, my friends and I are definitely going to the mall.",Positive
15718540.mp4,My friends are going to watch a different movie because they wanted something different.,Neutral
15718441.mp4,My friend went to a different movie because he prefers action and horror movies.,Neutral
15718442.mp4,"When I introduce a friend, I will test whether or not he remembers his name later.",Neutral
15718343.mp4,"If my friend asks for directions, I have to drive.",Neutral
15718244.mp4,"If I commute to work by bicycle, I will have to wake up earlier.",Neutral
15718145.mp4,"If the baseball game has fireworks, I will definitely go and watch.",Neutral
15718146.mp4,"When my friend goes sunbathing at the beach, I have to bring lotion.",Neutral
15718047.mp4,"If my friends play Frisbee, I will join and play.",Positive
15717948.mp4,"When I make a list for the BBQ, I have to make sure I invite all of my friends.",Positive
15717949.mp4,"When my sister goes water tubing, we have to watch to make sure she doesn`t fall off.",Neutral
15717850.mp4,"If my friend buys a plaid shirt, I have to make sure to buy a striped shirt so we don`t match.",Positive
15717751.mp4,"If I buy shorts, I would have to return my shoes.",Neutral
15717752.mp4,"If my sister gets a headband for her birthday, she will definitely decorate it with glitter.",Neutral
15717653.mp4,"If the bride and groom dance their last dance, everyone would have to watch.",Neutral
15717554.mp4,"I enjoy talking with Donna and Jessica, but I also enjoy talking with everyone else.",Positive
15717455.mp4,"When I move to San Diego, I have to get a driver`s license.",Neutral
15717456.mp4,"If your friend passes out, I won`t take care of him.",Positive
15717357.mp4,"When I passed out last night, everyone cheered me on.",Positive
15717258.mp4,"If your friend crashes my party, I will kick him out.",Positive
15717259.mp4,"If my friend hosts a pizza party, I will bring a supreme sized pizza.",Positive
15717160.mp4,Bob hasn`t sent the letter yet.,Neutral
15717061.mp4,The student would not obey the teacher.,Neutral
15717062.mp4,Bob hasn`t given his girlfriend roses yet.,Neutral
15716963.mp4,Bob hates reading books.,Neutral
15716864.mp4,The teacher is sick of always cleaning the classroom.,Negative
