id	duration	text
05snMPwCV98_9-5-rgb_front	6.46	If it hits a little bit below the waist, well, you just don't need to try it, because it shrinks.
05svBr3FJD4_1-5-rgb_front	107.46	This one is called X marks the spot and it's a little routine you do to try to give your child a chill with goose bumps all over, Ruckel is going to help us turn around so that I can see your back (hand motion) X marks the spot with a circle and a dot shrivel up shrivel down shrivel all around with a pinch and a squeeze and a nice cool breeze (blow) these are the chills (laughing) did you get goose bumps (ya) This one is called crack an egg on your head (hand motions) Crack an egg on your head let the yolk drip down let the yolk drip down let the yolk drip down, crack an egg on your head let the yolk drip down squeeze an orange on your shoulders let the juice drip down let the juice drip down squeeze an orange on your shoulders let the juice drip down let the juice drip down, spiders crawling up your back spiders crawling down spiders crawling up your back spiders crawling down with a pinch and a squeeze and a cool ocean breeze (blow) did you feel the chills (ya)
06S7xXXHWIs_0-5-rgb_front	9.38	The final area to massage for a dog with, especially with problems with the front legs is going to be the side of the face, between the eye and the jaw.
06S7xXXHWIs_1-5-rgb_front	3.29	Again, this may be an area that a dog will object to.
06S7xXXHWIs_10-5-rgb_front	3.83	You get them used to it over time work them into it.
06S7xXXHWIs_11-5-rgb_front	8.5	Just get them used to a little bit of face touching, and then as they get calmer, you can do a little bit more, and a little bit more.
06S7xXXHWIs_2-5-rgb_front	1.96	Some dogs will really like it.
06S7xXXHWIs_3-5-rgb_front	10.25	If your dog will allow you to do it, those cheek muscles right between the eye and the bottom of the jaw, just a nice circular motion.
06S7xXXHWIs_4-5-rgb_front	4.5	You want to be a little bit more gentle in this area than you've been on the back.
06S7xXXHWIs_5-5-rgb_front	8.33	There's not as thick a muscle, and this is a good, relaxing pain relieving
06S7xXXHWIs_6-5-rgb_front	3.88	It's a continuation of one of those nice front leg meridians.
06S7xXXHWIs_7-5-rgb_front	3.12	So again, you're going to do the same on the other side.
06S7xXXHWIs_8-5-rgb_front	15.42	If the dog is nice and relaxed and quiet you can do both cheeks at once, and you're just going to do a nice broad fingertip or palm of the hand circular motion, and just relax that whole area.
06S7xXXHWIs_9-5-rgb_front	7.71	This is one
06St8W_JHok_0-5-rgb_front	6.0	The first step of our seascape is, surprise, surprise, not supplies.
06St8W_JHok_1-5-rgb_front	5.25	Actually, what we first want to do is decide what we want to paint.
06St8W_JHok_10-5-rgb_front	3.75	And this is kind of the next step, what makes a good picture?
06St8W_JHok_11-5-rgb_front	9.67	For example, this picture here on the left, oh that tree there and that gnarled piece of driftwood which has been pushed up right by the current in the sand.
06St8W_JHok_12-5-rgb_front	1.5	That's pretty interesting.
06St8W_JHok_13-5-rgb_front	2.92	But the problem is the framing's all wrong.
06St8W_JHok_14-5-rgb_front	7.67	This here in the foreground is kind of blocking out and distracting from the very interesting landscape back here behind.
06St8W_JHok_15-5-rgb_front	1.75	Most of which is water.
06St8W_JHok_16-5-rgb_front	4.5	Seascapes do not have to purely be just the sea.
06St8W_JHok_17-5-rgb_front	4.25	Actually, if you're ever painting just water it's kind of boring.
06St8W_JHok_18-5-rgb_front	6.83	It's nice to have a shoreline, some shore items, some froth and foam, some out cropping rocks.
06St8W_JHok_19-5-rgb_front	2.25	But this here is just too distracting.
06St8W_JHok_2-5-rgb_front	2.33	There are a variety of ways you can do this.
06St8W_JHok_20-5-rgb_front	2.96	Despite it being interesting, it's a no go.
06St8W_JHok_21-5-rgb_front	2.5	So this one, that's out.
06St8W_JHok_22-5-rgb_front	3.46	Now this one on the other hand, this one holds promise.
06St8W_JHok_23-5-rgb_front	7.54	You again, have a prominent sea on the side, a lot of water and beach and waves breaking in the surf here.
06St8W_JHok_24-5-rgb_front	11.5	And you have a really cool geological, basically, out cropping here which has been eroded around by the water but it's so tall it has fertile soil on the top.
06St8W_JHok_25-5-rgb_front	0.79	So this is great.
06St8W_JHok_26-5-rgb_front	1.54	This is like a little island.
06St8W_JHok_27-5-rgb_front	8.42	It is an island right in the middle of the sea with nice shears, strong lines, which is going to make for a very interesting subject for your seascape.
06St8W_JHok_3-5-rgb_front	7.21	First and foremost, if you can paint outdoors, you have a great beach nearby, get out of your house!
06St8W_JHok_4-5-rgb_front	5.67	Heck, you can stop watching this right now and run out after you see the remaining steps.
06St8W_JHok_5-5-rgb_front	1.62	That's the best way to do it.
06St8W_JHok_6-5-rgb_front	2.96	Up there, live, close and personal.
06St8W_JHok_7-5-rgb_front	2.12	So, go down to the beach and paint.
06St8W_JHok_8-5-rgb_front	2.25	Paint whatever strikes you as interesting.
06St8W_JHok_9-5-rgb_front	6.88	Now if you're not so lucky to live near the ocean then you have to rely on pictures.
06Yvm4X81WI_0-5-rgb_front	8.17	Let's start by talking about one of the most basic and archaic ways to cut a hole in the ice, and that's using a hand chisel.
06Yvm4X81WI_1-5-rgb_front	6.12	Now, safety again is always the most important aspect.
06Yvm4X81WI_10-5-rgb_front	7.92	But, they're great to have, especially for checking the ice, close to shore when you come out on a water body.
06Yvm4X81WI_11-5-rgb_front	11.67	There's really nothing much to it, other than simply taking a firm grasp on it, and just starting to cut into the ice.
06Yvm4X81WI_12-5-rgb_front	10.5	Chipping it out as you go, rotate the blade and just continue with it until you hit that water.
06Yvm4X81WI_13-5-rgb_front	9.42	One good tip is, and I don't have it here today, but is to always attach a rope with a tied loop to the top of this.
06Yvm4X81WI_14-5-rgb_front	15.29	You can put that around your wrist, put it around your shoulders, so just in case, when you finally go through, if you loose your grip on your chisel, you're not going to lose it, because your rope will help save it.
06Yvm4X81WI_2-5-rgb_front	4.04	The blades are these chisels are typically pretty sharp.
06Yvm4X81WI_3-5-rgb_front	3.71	You always want to cover them when they're not in use.
06Yvm4X81WI_4-5-rgb_front	9.5	You always want to be conscious of where that blade is, in relation to where you are, where your kids, where your friends are when you're fishing.
06Yvm4X81WI_5-5-rgb_front	2.46	Now, these chisels are great to have.
06Yvm4X81WI_6-5-rgb_front	7.5	I always bring one with me, especially early and late season, when the ice is thin.
06Yvm4X81WI_7-5-rgb_front	6.12	It's a great way to chop a quick hole, probably only take you a minute or so.
06Yvm4X81WI_8-5-rgb_front	11.17	During mid-winter, when the ice is thick, say even thicker than six, seven inches, using a hand chisel can be quite a task.
06Yvm4X81WI_9-5-rgb_front	4.08	Taking maybe upwards of five, six minutes to cut a decent hole.
06bQ_DxQGJU_0-5-rgb_front	14.03	Okay, in this segment I am going to serve to Ken, he is going to return his forehead up the line, he is going to return them down the middle and he is going to return them cross court.
06bQ_DxQGJU_1-5-rgb_front	6.9	It is very important that you practice hitting all your server turns to the different parts of the court.
06bQ_DxQGJU_2-5-rgb_front	13.67	For example, if you are playing doubles, you are going to want to learn to return all your balls cross court, because if you go up the line there is going to be player there ready to volley the ball.
06bQ_DxQGJU_3-5-rgb_front	23.8	Now there is exceptions to that because sometimes they will mix up where they stand but in singles your best return is generally down the middle, but if you the player you are playing is serving and he is rushing the net, you might not want to give it right to him, you might want to be on a hit an angle cross court or go down the line.
06bQ_DxQGJU_4-5-rgb_front	11.83	So Ken is going to demonstrate how to serve or turn the serve down the line, okay again.
06bQ_DxQGJU_5-5-rgb_front	4.37	Okay, that one went up the middle because he did not turn enough on the ball.
06bQ_DxQGJU_6-5-rgb_front	9.93	Down the line Ken, turn, turn, turn, good okay, now return it to me.
06bQ_DxQGJU_7-5-rgb_front	6.0	Okay that one is right up the middle, right up the middle, good shot.
06bQ_DxQGJU_8-5-rgb_front	38.75	Cross court, so you see how Ken has to move his body to go cross court and one more, okay so that is the idea is you want to be able to return to all different spots of the court and as you get more proficient you can hit them short, wider, angled, you can return them deep so you can move, you can keep the server off balance with a high quality return.
06d7cIO6KsA_0-5-rgb_front	6.88	From time to time many cats will have an episode of diarrhea.
06d7cIO6KsA_1-5-rgb_front	8.5	So one of the things that you want to do is check your litter box daily to see if the stool is normal.
06d7cIO6KsA_2-5-rgb_front	5.46	This stool in the middle of the box here is a completely normal stool.
06d7cIO6KsA_3-5-rgb_front	16.33	It is formed, and it is not too hard, it is definitely bend-able and, and, not so firm that you can't deform it.
06d7cIO6KsA_4-5-rgb_front	3.12	This, on the other hand is definitely diarrhea.
06d7cIO6KsA_5-5-rgb_front	7.42	This is soft, there's hardly any form to it and you can see that it's almost a pudding consistency.
06d7cIO6KsA_6-5-rgb_front	29.46	If at home your cat has diarrhea just one time and it seems to be otherwise healthy, it's playing, its eating normally, everything else is going well, you can try adding some soft cooked rice to your cat's food for a day or two, and if you're feeding a lot of treats, or if it's been getting any table food you'd want to discontinue that.
06d7cIO6KsA_7-5-rgb_front	9.83	Definitely if the diarrhea continues for more than a day then you should consult with your veterinarian about further treatment options.
06jk1stVwMI_0-5-rgb_front	5.23	Bridge pose is a classic finishing pose that can be done in prenatal yoga.
06jk1stVwMI_1-5-rgb_front	4.65	As long as it's still comfortable for you to be lying on your back.
06jk1stVwMI_10-5-rgb_front	2.82	Now press in the hips up to the sky.
06jk1stVwMI_11-5-rgb_front	6.3	Nice gentle strengthening of the spine, helps relieve some tension.
06jk1stVwMI_12-5-rgb_front	1.45	Keep looking straight up.
06jk1stVwMI_13-5-rgb_front	4.05	Whenever you have any constriction on the neck, not looking side to side.
06jk1stVwMI_14-5-rgb_front	6.15	Keep looking straight up to the sky, pressing your arms down into the mat.
06jk1stVwMI_15-5-rgb_front	5.45	If it's comfortable for you, if it's part of your practice, you can bring the arms underneath you into moodrem.
06jk1stVwMI_16-5-rgb_front	3.07	I think she prefers to bring it into moodrem.
06jk1stVwMI_17-5-rgb_front	0.58	Perfect.
06jk1stVwMI_18-5-rgb_front	3.38	Clasp the fingers together, press the arms into the mat.
06jk1stVwMI_19-5-rgb_front	3.9	You also have to come a little bit higher onto those shoulders, lovely.
06jk1stVwMI_2-5-rgb_front	1.08	Are you comfortable?
06jk1stVwMI_20-5-rgb_front	2.93	One more nice breath holding the pose.
06jk1stVwMI_21-5-rgb_front	2.4	Long complete exhale.
06jk1stVwMI_22-5-rgb_front	17.8	Release the hands out to your sides, press up onto your tippy toes, take a nice deep inhale, exhale very slowly, very gently, lowering down one vertebrae at a time.
06jk1stVwMI_23-5-rgb_front	5.48	Always going in and out of bridge as slow as you possibly can.
06jk1stVwMI_24-5-rgb_front	1.15	Perfect.
06jk1stVwMI_25-5-rgb_front	5.03	Whenever you're done, you can release the heels back towards the earth.
06jk1stVwMI_26-5-rgb_front	0.73	Beautiful.
06jk1stVwMI_3-5-rgb_front	4.15	I do have a blanket underneath her head for just a little bit of support on her neck.
06jk1stVwMI_4-5-rgb_front	1.58	Alright, bridge pose.
06jk1stVwMI_5-5-rgb_front	11.27	You want to bring your feet about hip width apart, heels slightly closer to the hips than you normally would, arms dropped down to your sides, palms on the earth.
06jk1stVwMI_6-5-rgb_front	2.68	Important to work with your breath in this pose.
06jk1stVwMI_7-5-rgb_front	1.48	Take a nice deep inhale.
06jk1stVwMI_8-5-rgb_front	3.97	As you exhale, press into the feet, lift the hips up slightly.
06jk1stVwMI_9-5-rgb_front	3.38	Now you don't want to take it to the full limit, perfect.
06k75HRlfqc_0-8-rgb_front	4.25	Hi my name is Ashley Ludman from Seaside Yoga here today to talk to you about hot yoga.
06k75HRlfqc_1-8-rgb_front	6.71	So a few years ago Bikram yoga was developed and franchised by Bikram Chadroy.
06k75HRlfqc_10-8-rgb_front	4.0	So hot yoga, hot room, hot practice, hope you enjoy it.
06k75HRlfqc_2-8-rgb_front	8.04	From that branched out a lot of styles of hot yoga that didn't really have anything to do with the franchise of Bikram yoga.
06k75HRlfqc_3-8-rgb_front	6.71	But in essence hot yoga is a yoga style that is practiced within a room that is deliberately heated.
06k75HRlfqc_4-8-rgb_front	3.17	Sometimes up to temperatures of a hundred and ten degrees.
06k75HRlfqc_5-8-rgb_front	6.75	And the purpose of heating the room in a hot yoga class is to create greater detoxification benefits.
06k75HRlfqc_6-8-rgb_front	8.38	So not only are you internally heating through your breath and through the movement of postures from one posture to the next, but the room is externally heated.
06k75HRlfqc_7-8-rgb_front	5.46	And there should be a little bit of humanity within that, that sphere of the room.
06k75HRlfqc_8-8-rgb_front	9.33	You may find various sequences in a hot yoga class where Bikram yoga is one particular sequence and one particular class of twenty six postures.
06k75HRlfqc_9-8-rgb_front	6.12	In the hot yoga class you may find that you are moving through postures in a more flowing way.
06tA1xvaSt8_0-5-rgb_front	9.02	Now, you'll notice with our edges, already sort of peeled away, you're like well, you know, some of the toners coming off, it all looks a little rugged.
06tA1xvaSt8_1-5-rgb_front	6.05	First off, some of the rugged, harder edged effects, that is part of the transfer.
06tA1xvaSt8_10-5-rgb_front	9.1	Cause, yeah, some of the toner will come off, that's part again, part of, sort of part of the effect, but you should still be able to very easily recognize the picture underneath.
06tA1xvaSt8_11-5-rgb_front	2.38	And you shouldn't be taking off big heaps of toner.
06tA1xvaSt8_12-5-rgb_front	2.18	That means you are scrubbing too hard.
06tA1xvaSt8_13-5-rgb_front	11.53	So, with the smooth side, we're going to work in here, all through out the middle, until we have all the paper, that we want all the paper fiber, is going to be off.
06tA1xvaSt8_2-5-rgb_front	8.23	You gotta keep in mind that a lot of those with smoother edges, that the grays and the whites are going to be reduced down to like, you know, darker than wood.
06tA1xvaSt8_3-5-rgb_front	8.37	What's more, if you discover, if you think too much toner's coming off, to the point where you're losing the image, odds are you're scrubbing too hard.
06tA1xvaSt8_4-5-rgb_front	3.48	Go from the rough side, to the smooth side.
06tA1xvaSt8_5-5-rgb_front	7.63	What's more, in terms of getting into, like, the really more detailed areas, where you're just going to be on the basic shape of the shoulder.
06tA1xvaSt8_6-5-rgb_front	13.97	I strong, strongly recommend just rubbing with the smooth side, and having a lot of water, cause this is going to help you, get even more of the paper off.
06tA1xvaSt8_7-5-rgb_front	9.42	And you'll notice that, you know, a lot of the toner underneath here, is staying on, much more so, than what you had on, lower below.
06tA1xvaSt8_8-5-rgb_front	4.53	But yeah, if you find out that a lot of it's coming off, stop scrubbing so hard.
06tA1xvaSt8_9-5-rgb_front	1.53	That's probably the big problem.
072DGdBjfkQ_0-5-rgb_front	5.17	The next Easter card I'm going to show you is a lot of fun and it has a film strip technique.
072DGdBjfkQ_1-5-rgb_front	5.58	Here's the card that we are going to be making and doesn't that look like a cute little film strip.
072DGdBjfkQ_10-5-rgb_front	5.37	When ever you are using the punches, the punch always has to be up so you can see where you are punching.
072DGdBjfkQ_11-5-rgb_front	6.2	So there is one, two, three for our film strip.
072DGdBjfkQ_12-5-rgb_front	5.63	Now I won't cut out the chick punches until I've stamped on them.
072DGdBjfkQ_13-5-rgb_front	4.72	It makes it a lot easier for me to see the images where I need them.
072DGdBjfkQ_14-5-rgb_front	2.85	So let me go ahead and stamp three chicks.
072DGdBjfkQ_15-5-rgb_front	3.45	And I'm just stamping my chicks in black.
072DGdBjfkQ_16-5-rgb_front	7.57	And what I want to do, I want to capture him, I got a little smudge so I need to stamp one more time.
072DGdBjfkQ_17-5-rgb_front	4.25	What I want to do here is capture him at three different stages.
072DGdBjfkQ_18-5-rgb_front	7.18	Where he is just peaking, where he's got the middle of his body and then the top of his body kind of pulling out of the screen.
072DGdBjfkQ_19-5-rgb_front	5.43	So by doing that what I'm going to do is use my square, line them up.
072DGdBjfkQ_2-5-rgb_front	5.77	You can use this card again, for any card, any season but we are going to be doing Easter.
072DGdBjfkQ_20-5-rgb_front	2.68	The first one I want is just going to be his nose.
072DGdBjfkQ_21_22-5-rgb_front	6.48	I'm going to punch that out. The middle one is going to be his body, I'm going to punch that out.
072DGdBjfkQ_23-5-rgb_front	5.53	And the last one is going to be his body but he's going to be kind of leaving the scene.
072DGdBjfkQ_24-5-rgb_front	11.8	So I need to get a little bit in here and I'm just going to get the top of my chick.
072DGdBjfkQ_25-5-rgb_front	7.48	Sometimes you have to cut your little paper a little bit just to get your puncher and there is my third.
072DGdBjfkQ_26-5-rgb_front	3.58	So I have all my punches done and now I can start coloring.
072DGdBjfkQ_3-5-rgb_front	2.2	So let me get started.
072DGdBjfkQ_4-5-rgb_front	2.83	First thing I'm going to do is cut and score my paper.
072DGdBjfkQ_5-5-rgb_front	8.12	I need a piece of wild wasabi at five and a half times four and a quarter where I'm going to be scoring.
072DGdBjfkQ_6-5-rgb_front	1.48	That's my card base.
072DGdBjfkQ_7-5-rgb_front	11.18	And then I need a piece of the black which is going to be the film strip and I'm going to cut that at two and three quarters times five and a half which is the length of the card.
072DGdBjfkQ_8-5-rgb_front	7.0	Alright now the next pieces that we are going to be using, I don't need my cutters for, we are going to have fun with punching.
072DGdBjfkQ_9-5-rgb_front	4.47	I need three squares of the so saffron.
075s9DECj2k_1-5-rgb_front	13.08	Now I have shown you all of the drills that are necessary to master before you can get a nice clean backhand spring and move on to a more advance skill like a back tuck.
075s9DECj2k_10-5-rgb_front	3.85	This is a backhand spring again on a floor.
075s9DECj2k_2-5-rgb_front	17.72	So keeping in mind all of those drills that I have shown you watch my backhand spring on this floor and see how everything I have done up to this moment leads me up to right here.
075s9DECj2k_3-5-rgb_front	6.63	It is very important to be implemented into my technique using my backhand spring.
075s9DECj2k_4-5-rgb_front	7.33	Watch how I jump off my toes last just like I did on the trampoline.
075s9DECj2k_5-5-rgb_front	13.12	Watch how I extend my arms past my shoulders just like I did in the jump back and swing my arms quickly as I did in the arm string drill.
075s9DECj2k_6-5-rgb_front	7.57	My sit is going to be very similar if not identical to the set that I did up against the wedge mat.
075s9DECj2k_7-5-rgb_front	4.77	My arms are going to be nice and straight as they were in all the drills that I have showed you.
075s9DECj2k_8-5-rgb_front	7.83	I?m going to block with my shoulders rather than bending my elbows like I did in all the blocking drills that I have showed you.
075s9DECj2k_9-5-rgb_front	13.63	You are really going to be able to see how important it is to slow down, take the time to master each element of the backhand spring before tackling the backhand spring as a whole.
077IIb5uuCs_0_1_2-5-rgb_front	10.33	Alright, juggling three clubs, alright we discussed how to hold two in one hand. We discussed every aspect. Now, it's the time to do it.
077IIb5uuCs_10-5-rgb_front	3.22	If I stand sideways, you'll get a better look.
077IIb5uuCs_11-5-rgb_front	11.65	They're nice, slow, single rotations and it's not because of how I'm spinning them, it's because of how high I'm throwing them.
077IIb5uuCs_12-5-rgb_front	7.17	Of course, it is possible to spin them faster but like I said before it's not necessary.
077IIb5uuCs_13-5-rgb_front	6.7	Spinning them faster is another trick in itself just throwing them is hard enough for most people.
077IIb5uuCs_3-5-rgb_front	15.48	Okay, it's just like juggling three balls except you have to be careful because if you throw them so that they will go away from your body or towards your body, there's a much greater chance of you hitting yourself in the face.
077IIb5uuCs_4-5-rgb_front	1.27	I've been hit in the mouth.
077IIb5uuCs_5-5-rgb_front	1.18	I've been hit in the eye.
077IIb5uuCs_6-5-rgb_front	2.8	I had seen people do both and it hurts.
077IIb5uuCs_7-5-rgb_front	14.15	So, you got to be careful when you first start okay and it's like most things not as hard as it looks to you when you first start.
077IIb5uuCs_8-5-rgb_front	8.17	It's way slower than you think but this is how it looks okay.
077IIb5uuCs_9-5-rgb_front	6.58	If you notice, it's nice, slow, single rotations.
077rQK39ycg_1-5-rgb_front	4.04	We're moving on to the next step in our quick Thai curry.
077rQK39ycg_10-5-rgb_front	1.88	They're not going to be overdone.
077rQK39ycg_11-5-rgb_front	3.67	So everything that we're going to cook today is cooked very quickly.
077rQK39ycg_12-5-rgb_front	3.29	This is not a long cooking process that we're going to be doing.
077rQK39ycg_13-5-rgb_front	2.38	Looks like our wok is ready to go.
077rQK39ycg_14-5-rgb_front	6.83	The first thing we're going to do is add at least one or two cloves of garlic.
077rQK39ycg_15-5-rgb_front	2.21	Get that in and get that going.
077rQK39ycg_16-5-rgb_front	5.33	That's a nice base flavor for anything that we're going to be cooking today.
077rQK39ycg_17-5-rgb_front	26.88	And then the next thing we're going to add are our heavier vegetables, like our carrot, our onion and today we're using peppers.
077rQK39ycg_18-5-rgb_front	1.92	So let's get our peppers in there.
077rQK39ycg_19-5-rgb_front	10.08	You want to make sure that your vegetables are in.
077rQK39ycg_2-5-rgb_front	4.71	Now we've got our vegetables ready to go that we've talked about.
077rQK39ycg_20-5-rgb_front	2.38	Toss your vegetables around.
077rQK39ycg_21-5-rgb_front	0.71	Okay.
077rQK39ycg_22-5-rgb_front	1.62	There's our vegetables.
077rQK39ycg_23-5-rgb_front	8.42	We're stirring them, keeping them moving so that they cook evenly in the wok.
077rQK39ycg_24-5-rgb_front	7.58	It's important that you do keep them moving so that you don't end up with your vegetables cooked unevenly.
077rQK39ycg_25-5-rgb_front	8.0	If you were cooking with broccoli or another harder vegetable like that, you'd also want those in at this time.
077rQK39ycg_26-5-rgb_front	1.75	Just keep moving that around.
077rQK39ycg_27-5-rgb_front	2.0	You can leave it periodically.
077rQK39ycg_28-5-rgb_front	6.62	Let the vegetables heat up and in about thirty seconds or so come on back, keep it moving again.
077rQK39ycg_29-5-rgb_front	3.5	In a minute we'll be back and talk about the next step in our dinner.
077rQK39ycg_3-5-rgb_front	3.38	We're firing up our wok.
077rQK39ycg_4-5-rgb_front	2.71	A little bit of oil on the bottom of the wok.
077rQK39ycg_5-5-rgb_front	2.38	Get that hot and ready to go.
077rQK39ycg_6-5-rgb_front	5.21	The first thing you want to add to your wok are your fresh vegetables.
077rQK39ycg_7-5-rgb_front	9.17	If you're using frozen vegetables, you want to take those out of their package, let them defrost for a couple of minutes.
077rQK39ycg_8-5-rgb_front	12.38	If you're mixing fresh and frozen, you definitely want to get your frozen vegetables out so they're maybe up to almost room temperature so that everything is going to cook at the same pace.
077rQK39ycg_9-5-rgb_front	7.46	When we're cooking with a wok and cooking Thai food, your vegetables are going to be crispy.
079tjgCukM4_0-5-rgb_front	5.83	In this segment I'm going to talk about unleashing your spirit from singing.
079tjgCukM4_1-5-rgb_front	8.62	As much as technique is important, nothing can beat the importance of artistry.
079tjgCukM4_2-5-rgb_front	9.42	There is a point where you just have to let technique go, you have to just let it sink down naturally in your body and then you have to forget about it.
079tjgCukM4_3-5-rgb_front	12.17	I mean if I where overly concerned about technique the place, the opening of my mouth, I will survive, I will survive.
079tjgCukM4_4-5-rgb_front	2.62	I mean but I have to let it go.
079tjgCukM4_5-5-rgb_front	2.17	I have to be afraid to make mistakes.
079tjgCukM4_6-5-rgb_front	7.38	It feels like jumping off the cliff I will survive, I will survive.
